,tconst,primaryTitle,Directors,originalTitle,startYear,runtimeMinutes,averageRating,numVotes,genre 1,Crew
2294,tt0099994,Leatherface: Texas Chainsaw Massacre III,Jeff Burr,Leatherface: Texas Chainsaw Massacre III,1990-01-01,85,5,17800,Horror,"Mike Romo, Miriam Byrd-Nethery, Kate Hodge"
2297,tt0100003,The Lemon Sisters,Joyce Chopra,The Lemon Sisters,1989-01-01,93,5,1139,Comedy,"Paulette Attie, Joe Milazzo, Rachel Aviva, Diane Keaton"
2299,tt0100024,Life Is Sweet,Mike Leigh,Life Is Sweet,1990-01-01,103,7,10762,Comedy,"Jack Thorpe Baker, Claire Skinner, Alison Steadman"
2300,tt0100029,Lionheart,Sheldon Lettich,Lionheart,1990-01-01,108,6,37619,Action,"Michael M. Foley, Lonnie Burr, Billy Blanks, Jean-Claude Van Damme"
2301,tt0100031,Lisa,Gary Sherman,Lisa,1989-01-01,95,5,2162,Drama,"Sharon Clark, Monty Laird, Staci Keanan"
2303,tt0100046,The Long Walk Home,Richard Pearce,The Long Walk Home,1990-01-01,97,7,4416,Drama,"Dorothy Love Coates, Jim Haffey, Richard Habersham, Sissy Spacek"
2305,tt0100049,Longtime Companion,Norman René,Longtime Companion,1989-01-01,96,7,5927,Drama,"Rob Hallenbake, Matthew Ebert, Bruce Davison, Stephen Caffrey"
2306,tt0100054,Lord of the Flies,Harry Hook,Lord of the Flies,1990-01-01,90,6,31803,Adventure,"Chris Furrh, Balthazar Getty, Ruurd M. Fenenga"
2307,tt0100065,Love at Large,Alan Rudolph,Love at Large,1990-01-01,97,5,1361,Comedy,"Steve Karatzas, Debra Dusay, Tom Berenger"
2310,tt0100083,Macken - Roy's & Roger's Bilservice,Claes Eriksson,Macken - Roy's & Roger's Bilservice,1990-01-01,92,6,1134,Comedy,"Jan Rippe, Anders Eriksson"
2311,tt0100087,Madhouse,Tom Ropelewski,Madhouse,1990-01-01,90,5,3429,Comedy,"Alison La Placa, Elaine Moe"
2313,tt0100095,Maine Pyar Kiya,Sooraj R. Barjatya,Maine Pyar Kiya,1989-01-01,192,7,12609,Drama,"Raju Srivastava, Sooraj R. Barjatya, Salman Khan"
2317,tt0100107,Maniac Cop 2,William Lustig,Maniac Cop 2,1990-01-01,90,5,7904,Action,"Buddy Miles, Vincent Russo, Robert Davi"
2318,tt0100112,The Hairdresser's Husband,Patrice Leconte,Le mari de la coiffeuse,1990-01-01,82,7,10023,Comedy,"Roland Bertin, Anne-Marie Pisani, Benoît Barbier, Jean Rochefort"
2319,tt0100114,Marked for Death,Dwight H. Little,Marked for Death,1990-01-01,93,5,23065,Action,"Richard Delmonte, Tony Williams, Peter Tosh, Steven Seagal"
2321,tt0100129,Meet the Applegates,Michael Lehmann,Meet the Applegates,1990-01-01,90,5,2482,Comedy,"Camille Cooper, Steven Robert Ross, Ed Begley Jr."
2322,tt0100133,Memphis Belle,Michael Caton-Jones,Memphis Belle,1990-01-01,107,6,29275,Action,"Michael Caton-Jones, Paul Chaplin, Norman Dorme, Matthew Modine"
2323,tt0100134,Men Don't Leave,Paul Brickman,Men Don't Leave,1990-01-01,115,6,2651,Comedy,"Dodie Foster, Paul Brickman, Mark Hardwick, Jessica Lange"
2324,tt0100135,Men at Work,Emilio Estevez,Men at Work,1990-01-01,98,5,25562,Action,Charlie Sheen
2325,tt0100140,Mermaids,Richard Benjamin,Mermaids,1990-01-01,110,6,33586,Comedy,"Cher, Shelley Fabares, Eydie Gormé, Cher"
2326,tt0100142,Metropolitan,Whit Stillman,Metropolitan,1990-01-01,98,7,11778,Comedy,"Francis Creighton, Will Kempe"
2327,tt0100143,Miami Blues,George Armitage,Miami Blues,1990-01-01,97,6,9332,Comedy,"Bobo Lewis, Johnny Ventura, Wendy Thorlakson, Fred Ward"
2328,tt0100148,Midnight Ride,Bob Bralver,Midnight Ride,1990-01-01,93,5,1059,Action,"Lezlie Deane, Leslie La Penna, Regina Krueger"
2329,tt0100151,Mindwalk,Bernt Amadeus Capra,Mindwalk,1990-01-01,112,7,3155,Drama,"Elmar Schloter, Liv Ullmann"
2330,tt0100152,Mindwarp,Steve Barnett,Mindwarp,1991-01-01,96,5,2686,Horror,"Gene McGarr, William McCrow, Bruce Campbell"
2331,tt0100156,Mirror Mirror,Marina Sargenti,Mirror Mirror,1990-01-01,104,5,1954,Horror,"Tom Bresnahan, Marina Sargenti, Karen Black"
2332,tt0100157,Misery,Rob Reiner,Misery,1990-01-01,107,7,219065,Drama,"Frances Sternhagen, Graham Jarvis, Andrew Precht, James Caan"
2333,tt0100161,Mister Frost,Philippe Setbon,Mister Frost,1990-01-01,104,5,2701,Crime,"Philippe Setbon, Jeff Goldblum"
2335,tt0100168,Mo' Better Blues,Spike Lee,Mo' Better Blues,1990-01-01,129,6,13011,Drama,"Herbert Daughtry, Kenny Kirkland, Robin Harris, Denzel Washington"
2339,tt0100196,Mountains of the Moon,Bob Rafelson,Mountains of the Moon,1990-01-01,136,7,3969,Adventure,"Paul Onsongo, William Harrison, Patrick Bergin"
2340,tt0100200,Mr. & Mrs. Bridge,James Ivory,Mr. & Mrs. Bridge,1990-01-01,126,6,3252,Drama,"Andy Knott, Bob Dole, Milton Abel, Paul Newman"
2341,tt0100201,Mr. Destiny,James Orr,Mr. Destiny,1990-01-01,116,6,12799,Comedy,"Collin Bernsen, Sky Berdahl, Bryan Buffington, Jim Belushi"
2342,tt0100211,Music Box,Costa-Gavras,Music Box,1989-01-01,124,7,8154,Crime,"György Emõd, Márta Sebestyén, Jane MacIver, Jessica Lange"
2343,tt0100212,My Blue Heaven,Herbert Ross,My Blue Heaven,1990-01-01,97,6,21738,Comedy,"Larry Block, Greta Blackburn, Julie Bovasso, Steve Martin"
2347,tt0100224,Narrow Margin,Peter Hyams,Narrow Margin,1990-01-01,97,6,9690,Action,"Ted Stidder, Nick Hyams, Gene Hackman"
2348,tt0100232,Navy Seals,Lewis Teague,Navy Seals,1990-01-01,113,5,17278,Action,"Jim Cuddy, Tom Sean Foley, Charlie Sheen"
2349,tt0100234,Close-Up,Abbas Kiarostami,Nema-ye Nazdik,1990-01-01,98,8,20962,Biography,NONE
2350,tt0100240,The NeverEnding Story II: The Next Chapter,George Miller,The NeverEnding Story II: The Next Chapter,1990-01-01,90,5,26658,Adventure,"Michael Ende, George Miller, Ray Andrew, Jonathan Brandis"
2351,tt0100258,Night of the Living Dead,Tom Savini,Night of the Living Dead,1990-01-01,92,6,43623,Horror,"John A. Russo, Dyrk Ashton, Bill Cardille, Tony Todd"
2352,tt0100260,Nightbreed,Clive Barker,Nightbreed,1990-01-01,102,6,24571,Action,"Craig Sheffer, Anne Bobby, Craig Sheffer"
2353,tt0100263,Nikita,Luc Besson,Nikita,1990-01-01,117,7,73665,Action,"Jean-Claude Bolle-Reddat, Tchéky Karyo, Luc Besson, Anne Parillaud"
2357,tt0100274,Nouvelle vague,Jean-Luc Godard,Nouvelle vague,1990-01-01,90,6,1530,Drama,"Laure Killing, Joseph Lisbona, Werner Pirchner"
2359,tt0100280,Nuns on the Run,Jonathan Lynn,Nuns on the Run,1990-01-01,89,6,8646,Comedy,"Jonathan Lynn, Eric Idle"
2360,tt0100301,Opportunity Knocks,Donald Petrie,Opportunity Knocks,1990-01-01,103,6,3236,Comedy,"Mory Kanté, Sarajane Avidon, Beatrice Fredman, Dana Carvey"
2361,tt0100303,Operation Corned Beef,Jean-Marie Poiré,L'opǸration Corned Beef,1991-01-01,105,6,2846,Action,"Luc Barney, Françoise Noyon, Didier Gustin, Christian Clavier"
2364,tt0100318,Pacific Heights,John Schlesinger,Pacific Heights,1990-01-01,102,6,21402,Thriller,"Florence Sundstrom, Michael Parker, Frank DiElsi, Melanie Griffith"
2368,tt0100337,Pasport,Georgiy Daneliya,Pasport,1990-01-01,103,7,1147,Adventure,"Galina Churilina, Gérard Darmon, Gelena Kirik, Gérard Darmon"
2370,tt0100339,Patlabor: The Movie,Mamoru Oshii,KidÇï keisatsu patorebǽ: GekijÇï-ban,1989-01-01,100,7,5303,Action,"Tomomichi Nishimura, Ryûnosuke Ôbayashi, Blain Fairman, Toshio Furukawa"
2376,tt0100369,The Pit and the Pendulum,Stuart Gordon,The Pit and the Pendulum,1991-01-01,97,6,5127,Horror,"Rona De Ricci, Lance Henriksen"
2381,tt0100395,Postcards from the Edge,Mike Nichols,Postcards from the Edge,1990-01-01,101,6,18389,Comedy,"Bazil Donovan, Meryl Streep"
2383,tt0100403,Predator 2,Stephen Hopkins,Predator 2,1990-01-01,108,6,173271,Action,"Elpidia Carrillo, Kevin Peter Hall, Teri Weigel, Danny Glover"
2384,tt0100404,Presumed Innocent,Alan J. Pakula,Presumed Innocent,1990-01-01,127,6,43573,Mystery,"Guy Bonham, Bonnie Bedelia, Janis Corsair, Harrison Ford"
2385,tt0100405,Pretty Woman,Garry Marshall,Pretty Woman,1990-01-01,119,7,334411,Comedy,"Laura San Giacomo, Richard Gere, Jason Alexander"
2389,tt0100419,Problem Child,Dennis Dugan,Problem Child,1990-01-01,81,5,31739,Comedy,"Agim Coma, Amy Yasbeck, Vince Davis, Michael Oliver"
2392,tt0100436,Pump Up the Volume,Allan Moyle,Pump Up the Volume,1990-01-01,102,7,29704,Comedy,"Lennie Appelquist, Samantha Mathis, Nolan Hemmings, Christian Slater"
2394,tt0100442,Q&A,Sidney Lumet,Q & A,1990-01-01,132,6,6505,Crime,"Danny Darrow, Frank Raiter, International Chrysis, Nick Nolte"
2397,tt0100456,The Rainbow Thief,Alejandro Jodorowsky,The Rainbow Thief,1990-01-01,87,5,1452,Drama,"Jane Chaplin, Peter O'Toole"
2399,tt0100469,The Reflecting Skin,Philip Ridley,The Reflecting Skin,1990-01-01,96,6,8878,Drama,"Jeremy Cooper, Sheila Moore, Philip Ridley, Viggo Mortensen"
2400,tt0100470,Journey of Hope,Xavier Koller,Reise der Hoffnung,1990-01-01,105,7,2162,Adventure,"Albert Freuler, Xavier Koller, Necmettin Çobanoglu"
2402,tt0100485,Revenge,Tony Scott,Revenge,1990-01-01,124,6,19561,Action,"Gerardo Zepeda, Joaquín Martínez, Kevin Costner"
2403,tt0100486,Reversal of Fortune,Barbet Schroeder,Reversal of Fortune,1990-01-01,111,7,17299,Biography,"Alan Dershowitz, Jessika Cardinahl, Nicholas Kazan, Jeremy Irons"
2405,tt0100491,Riff-Raff,Ken Loach,Riff-Raff,1991-01-01,95,7,4695,Comedy,"Tex Comer, Emer McCourt, Robert Carlyle"
2406,tt0100496,My New Partner at the Races,Claude Zidi,Ripoux contre ripoux,1990-01-01,107,6,2100,Action,"Grace de Capitani, Philippe Noiret"
2409,tt0100502,RoboCop 2,Irvin Kershner,RoboCop 2,1990-01-01,117,5,88640,Action,"Belinda Bauer, Peter Weller, Nancy Allen"
2410,tt0100506,Rockula,Luca Bercovici,Rockula,1990-01-01,87,5,1118,Comedy,"Tawny Fere' Ellis, Sloan Fischer, Dean Cameron"
2411,tt0100507,Rocky V,John G. Avildsen,Rocky V,1990-01-01,104,5,143114,Drama,"Nicky Blair, Jonathan Avildsen, Jennifer Flavin, Sylvester Stallone"
2412,tt0100508,Rodrigo D: No futuro,Víctor Gaviria,Rodrigo D: No futuro,1990-01-01,93,7,1015,Crime,NONE
2415,tt0100514,The Rookie,Clint Eastwood,The Rookie,1990-01-01,120,5,28060,Action,"Chuck Courtney, Anthony Charnota, Paul Butler, Clint Eastwood"
2416,tt0100519,Rosencrantz & Guildenstern Are Dead,Tom Stoppard,Rosencrantz & Guildenstern Are Dead,1990-01-01,117,7,23122,Comedy,"Zoran Budak, Livio Badurina, Vili Matula, Gary Oldman"
2417,tt0100530,The Russia House,Fred Schepisi,The Russia House,1990-01-01,123,6,16681,Drama,"Yuriy Kushneryov, Pavel Sirotin, José de Sá Caetano, Sean Connery"
2419,tt0100536,S'en fout la mort,Claire Denis,S'en fout la mort,1990-01-01,90,6,1136,Drama,Isaach De Bankolé
2426,tt0100557,The Nasty Girl,Michael Verhoeven,Das schreckliche MÇÏdchen,1990-01-01,94,7,2660,Comedy,"Eva Maria Bayerwaltes, Cordula Bachl-Eberl, Alfons Biber, Lena Stolze"
2428,tt0100581,The Sect,Michele Soavi,La setta,1991-01-01,125,6,2968,Horror,Kelly Curtis
2429,tt0100586,Shadowzone,J.S. Cardone,Shadowzone,1990-01-01,88,5,1229,Horror,"Shawn Weatherly, Louise Fletcher"
2431,tt0100594,The Sheltering Sky,Bernardo Bertolucci,The Sheltering Sky,1990-01-01,138,6,13185,Adventure,"Amina Annabi, Mohamed Abdel Wahab, Mohammed Afifi, Debra Winger"
2435,tt0100602,A Shock to the System,Jan Egleson,A Shock to the System,1990-01-01,88,6,5424,Comedy,"David Schramm, Mike Cicchetti, Michael Caine"
2436,tt0100604,Short Time,Gregg Champion,Short Time,1990-01-01,97,6,2470,Action,"Jack Ammon, J. McRee Elrod, Dabney Coleman"
2439,tt0100611,Sibling Rivalry,Carl Reiner,Sibling Rivalry,1990-01-01,87,5,2836,Comedy,"Martha Goldhirsh, Bob Harks, Kirstie Alley"
2440,tt0100613,Side Out,Peter Israelson,Side Out,1990-01-01,100,5,2203,Comedy,"Ricci Luyties, Rudy Dvorak, Roger Clark, C. Thomas Howell"
2443,tt0100623,Singapore Sling,Nikos Nikolaidis,Singapore sling: O anthropos pou agapise ena ptoma,1990-01-01,111,6,2490,Drama,Nikos Nikolaidis
2444,tt0100625,A Chinese Ghost Story II,Siu-Tung Ching,Sien lui yau wan II: Yan gaan dou,1990-01-01,104,6,3777,Action,"Cheung-Kan Chow, Leslie Cheung"
2445,tt0100631,Ski Patrol,Richard Correll,Ski Patrol,1990-01-01,91,5,3953,Action,"Jim Beatty, Richard Correll, Roger Rose"
2448,tt0100666,Spaced Invaders,Patrick Read Johnson,Spaced Invaders,1990-01-01,100,5,3804,Adventure,"Fred Applegate, Douglas Barr, Michael McClure"
2451,tt0100680,Stanley & Iris,Martin Ritt,Stanley & Iris,1990-01-01,104,6,8119,Drama,"Michael C. Blackburn, Jane Fonda"
2452,tt0100681,Everybody's Fine,Giuseppe Tornatore,Stanno tutti bene,1990-01-01,118,7,4166,Drama,"Luigi Nicolosi, Salvatore Cascio, Marcello Mastroianni"
2454,tt0100685,State of Grace,Phil Joanou,State of Grace,1990-01-01,134,7,23473,Action,"Jordan Cronenweth, Phil Joanou, Sean Penn"
2456,tt0100688,Steel and Lace,Ernest Farino,Steel and Lace,1991-01-01,94,5,1044,Action,"Stacy Haiduk, Clare Wren"
2457,tt0100691,Stella,John Erman,Stella,1990-01-01,109,6,2747,Drama,"Bert Sommer, Philip Astor, Megan Gallivan, Bette Midler"
2459,tt0100699,On Tour,Gabriele Salvatores,TurnǸ,1990-01-01,91,7,1007,Comedy,"Gianni Minervini, Fabrizio Bentivoglio, Diego Abatantuono"
2466,tt0100740,Tales from the Darkside: The Movie,John Harrison,Tales from the Darkside: The Movie,1990-01-01,93,6,18221,Comedy,"Debbie Harry, Ralph Marrero, Nicolle Rochelle, Debbie Harry"
2468,tt0100747,Auntie Danielle,Étienne Chatiliez,Tatie Danielle,1990-01-01,112,7,3613,Comedy,"Étienne Chatiliez, Francis Boespflug, Nadia Barentin, Tsilla Chelton"
2469,tt0100757,Taxi Blues,Pavel Lungin,Taksi-blyuz,1990-01-01,110,7,1889,Comedy,"Pyotr Mamonov, Vyacheslav Gorbunchikov, Vladimir Chekasin, Pyotr Mamonov"
2470,tt0100758,Teenage Mutant Ninja Turtles,Steve Barron,Teenage Mutant Ninja Turtles,1990-01-01,93,6,96877,Action,"Elias Koteas, Rickey Boyd, Steve Barron, Judith Hoag"
2474,tt0100777,A Moment of Romance,Benny Chan,Tin joek yau ching,1990-01-01,87,7,1404,Action,"Goon Chung Wong, Andy Lau"
2477,tt0100791,To Sleep with Anger,Charles Burnett,To Sleep with Anger,1990-01-01,102,7,2732,Drama,"Rai Tasco, Robert Terry Lee, Ethel Ayler, Danny Glover"
2481,tt0100802,Total Recall,Paul Verhoeven,Total Recall,1990-01-01,113,7,338461,Action,"Ray Baker, Michael Ironside, Rachel Ticotin, Arnold Schwarzenegger"
2483,tt0100814,Tremors,Ron Underwood,Tremors,1990-01-01,96,7,142172,Comedy,"Finn Carter, Conrad Bachmann, Reba McEntire, Kevin Bacon"
2484,tt0100816,Tridev,Rajiv Rai,Tridev,1989-01-01,173,6,2134,Action,"Rajiv Rai, Sangeeta Bijlani, Sunny Deol"
2488,tt0100822,Tune in Tomorrow...,Jon Amiel,Tune in Tomorrow...,1990-01-01,107,6,1930,Comedy,"Pawl Burke, Marcus Roberts, Shirley Horn, Barbara Hershey"
2489,tt0100828,The Two Jakes,Jack Nicholson,The Two Jakes,1990-01-01,137,6,14657,Crime,"Rebecca Broussard, Sue Carlton, Perry Lopez, Jack Nicholson"
2492,tt0100842,The Unbelievable Truth,Hal Hartley,The Unbelievable Truth,1989-01-01,90,7,5772,Comedy,"Julia McNeal, Chris Cooke, Adrienne Shelly"
2495,tt0100851,Uranus,Claude Berri,Uranus,1990-01-01,100,7,1404,Comedy,"Morgan Fornes, Florence Darel, Philippe Noiret"
2497,tt0100873,Vincent & Theo,Robert Altman,Vincent & Theo,1990-01-01,140,6,4037,Biography,"Wladimir Yordanoff, Jip Wijngaarden, Paul Rhys, Tim Roth"
2500,tt0100881,Voices from Beyond,Lucio Fulci,Voci dal profondo,1994-01-01,91,5,1240,Horror,"Frances Nacman, Bettina Giovannini, Duilio Del Prete"
2505,tt0100911,"Welcome Home, Roxy Carmichael",Jim Abrahams,"Welcome Home, Roxy Carmichael",1990-01-01,95,5,5684,Comedy,"Valerie Landsburg, Richard Roylance, Winona Ryder"
2506,tt0100924,Where the Heart Is,John Boorman,Where the Heart Is,1990-01-01,107,5,1711,Comedy,"Telsche Boorman, Dabney Coleman"
2507,tt0100928,White Hunter Black Heart,Clint Eastwood,White Hunter Black Heart,1990-01-01,112,6,12737,Adventure,"Conrad Asquith, Catherine Neilson, Mel Martin, Clint Eastwood"
2509,tt0100931,Why Me?,Gene Quintano,Why Me?,1990-01-01,87,5,1292,Action,"René Assa, Michael Delahoussaye, Christopher Lambert"
2510,tt0100935,Wild at Heart,David Lynch,Wild at Heart,1990-01-01,125,7,96173,Comedy,"Sherilyn Fenn, Chris Isaak, Peter Bromilow, Nicolas Cage"
2513,tt0100944,The Witches,Nicolas Roeg,The Witches,1990-01-01,91,6,52022,Adventure,"Roald Dahl, Jasen Fisher, Merete Armand, Anjelica Huston"
2516,tt0100963,King of Beggars,Gordon Chan,Mo jong yuen So Hak Yee,1992-01-01,101,6,3982,Action,"Man Cheung, George Lam, Stephen Chow"
2517,tt0100967,Tiger Cage II,Woo-Ping Yuen,Sai hak chin,1990-01-01,95,6,1159,Action,Donnie Yen
2523,tt0100991,Hiruko the Goblin,Shin'ya Tsukamoto,YÇïkai hantǽ: Hiruko,1991-01-01,89,6,1505,Comedy,Kenji Sawada
2524,tt0100994,Young Guns II,Geoff Murphy,Young Guns II,1990-01-01,104,6,37379,Action,"Jenny Wright, Jon Bon Jovi, Emilio Estevez"
2532,tt0101020,Once a Thief,John Woo,Chung hang sei hoi,1991-01-01,108,6,6867,Action,"Leila Tong, Cherie Chung, Leslie Cheung"
2533,tt0101025,"Oh, Carmela!",Carlos Saura,"¶­Ay, Carmela!",1990-01-01,102,7,3113,Comedy,"Gabino Diego, Carmen Maura"
2534,tt0101026,Tie Me Up! Tie Me Down!,Pedro Almodóvar,ǁtame!,1989-01-01,101,7,30415,Comedy,"Malena Gracia, Pedro Almodóvar, Francisca Caballero, Victoria Abril"
2535,tt0101244,100 Days,Partho Ghosh,100 Days,1991-01-01,161,6,1104,Horror,Jackie Shroff
2536,tt0101252,29th Street,George Gallo,29th Street,1991-01-01,101,7,3028,Comedy,"Zbigniew Kozlowski, Alexander Fehr Blue, Frank Acciarito, Anthony LaPaglia"
2538,tt0101258,Days of Being Wild,Kar-Wai Wong,Ah fei jing juen,1990-01-01,100,7,23537,Crime,"Maggie Cheung, Patrick Tam, Leslie Cheung"
2540,tt0101268,Across the Tracks,Sandy Tung,Across the Tracks,1990-01-01,100,5,2576,Drama,"Dale Rosenbloom, Ricky Schroder"
2541,tt0101272,The Addams Family,Barry Sonnenfeld,The Addams Family,1991-01-01,99,6,170131,Comedy,"Raul Julia, B.H. Barry, Christopher Lloyd, Anjelica Huston"
2542,tt0101273,The Adjuster,Atom Egoyan,The Adjuster,1991-01-01,102,6,3603,Comedy,Elias Koteas
2543,tt0101276,Afraid of the Dark,Mark Peploe,Afraid of the Dark,1991-01-01,91,5,1268,Drama,"Ben Keyworth, Mark Peploe, Caroline Amies, James Fox"
2544,tt0101279,The Stranger,Satyajit Ray,Agantuk,1991-01-01,120,8,4132,Drama,"Mamata Shankar, Utpal Dutt"
2550,tt0101301,All I Want for Christmas,Robert Lieberman,All I Want for Christmas,1991-01-01,92,5,5309,Comedy,"Channing C. Holmes, Brad Butcher, Josiah Berryhill, Harley Jane Kozak"
2552,tt0101316,The Lover,Jean-Jacques Annaud,L'amant,1992-01-01,115,6,22307,Biography,"Arnaud Giovaninetti, Benoît Barbier, Hélène Patarot, Jane March"
2553,tt0101317,Lovers: A True Story,Vicente Aranda,Amantes,1991-01-01,103,7,3211,Crime,"Carlos Pérez Merinero, Victoria Abril"
2554,tt0101318,The Lovers on the Bridge,Leos Carax,Les amants du Pont-Neuf,1991-01-01,125,7,14588,Drama,"Leos Carax, Alain Dahan, Nikolaus Harnoncourt, Juliette Binoche"
2556,tt0101327,American Shaolin,Lucas Lowe,American Shaolin,1991-01-01,106,5,1523,Action,"Trent Bushey, Trent Bushey"
2561,tt0101356,Another You,Maurice Phillips,Another You,1991-01-01,94,5,4130,Comedy,"Chuck Dudley, Richard Pryor"
2563,tt0101366,Arena,Peter Manoogian,Arena,1989-01-01,115,5,2602,Action,"David L. Thompson, Brett Porter, Paul Satterfield"
2564,tt0101371,Article 99,Howard Deutch,Article 99,1992-01-01,100,6,3425,Comedy,"Donna Thomason, Ed Autry, Ernest Abuba, Ray Liotta"
2566,tt0101373,At Play in the Fields of the Lord,Hector Babenco,At Play in the Fields of the Lord,1991-01-01,189,6,3434,Drama,"Henry Urgoiti, Edwirges Ribeiro, Tom Berenger"
2567,tt0101393,Backdraft,Ron Howard,Backdraft,1991-01-01,137,6,83102,Action,"William Baldwin, Pat DiNizio, Jason Gedrick, Kurt Russell"
2572,tt0101428,The Beautiful Troublemaker,Jacques Rivette,La Belle Noiseuse,1991-01-01,238,7,8739,Drama,"Bernard Dufour, David Bursztein, Michel Piccoli"
2575,tt0101437,Beta,Indra Kumar,Beta,1992-01-01,171,6,2225,Drama,"Aruna Irani, Anil Kapoor"
2578,tt0101444,Big Girls Don't Cry... They Get Even,Joan Micklin Silver,Big Girls Don't Cry... They Get Even,1991-01-01,96,6,2009,Comedy,"Sean Blackman, Frank Mugavero, Jessica Seely, Griffin Dunne"
2579,tt0101452,Bill & Ted's Bogus Journey,Peter Hewitt,Bill & Ted's Bogus Journey,1991-01-01,93,6,77925,Adventure,"Tim Alexander, William Sadler, Reb Beach, Keanu Reeves"
2580,tt0101453,Billy Bathgate,Robert Benton,Billy Bathgate,1991-01-01,106,5,12367,Crime,"E.L. Doctorow, Dustin Hoffman"
2581,tt0101458,Until the End of the World,Wim Wenders,Bis ans Ende der Welt,1991-01-01,158,6,10693,Action,"Carmen Chaplin, Ernest Berk, Diogo Dória, William Hurt"
2584,tt0101465,Black Robe,Bruce Beresford,Black Robe,1991-01-01,101,7,7385,Adventure,"Lawrence Bayne, Peter James, Guy Provencher, Lothaire Bluteau"
2588,tt0101492,Body Parts,Eric Red,Body Parts,1991-01-01,88,5,4635,Horror,"Norman Snider, Eric Red, Jeff Fahey"
2591,tt0101497,The Boneyard,James Cummins,The Boneyard,1991-01-01,98,5,1377,Fantasy,"James Cummins, James Eustermann, Ed Nelson"
2593,tt0101502,The Borrower,John McNaughton,The Borrower,1991-01-01,92,5,1979,Comedy,"Tracy Arnold, Richard Fire, Rae Dawn Chong"
2596,tt0101507,Boyz n the Hood,John Singleton,Boyz n the Hood,1991-01-01,112,7,144968,Crime,"Lloyd Avery II, Ice Cube, Lexie Bigham, Cuba Gooding Jr."
2598,tt0101516,Bugsy,Barry Levinson,Bugsy,1991-01-01,136,6,29898,Biography,"Debrah Farentino, John Blackburn, Barry Levinson, Warren Beatty"
2600,tt0101523,The Butcher's Wife,Terry Hughes,The Butcher's Wife,1991-01-01,107,5,8654,Comedy,"Steven Jae Johnson, Demi Moore"
2601,tt0101524,By the Sword,Jeremy Kagan,By the Sword,1991-01-01,91,6,1635,Adventure,"Tolley Casparis, Diane Erickson, F. Murray Abraham"
2602,tt0101526,Children of Nature,Friðrik Þór Friðriksson,BÇôrn nÇ­ttǧrunnar,1991-01-01,82,7,1540,Drama,"Friðrik Þór Friðriksson, Margrét Ólafsdóttir, Einar Guðmundsson, Gísli Halldórsson"
2603,tt0101529,Cabeza de Vaca,Nicolás Echevarría,Cabeza de Vaca,1991-01-01,112,6,1163,Adventure,"Nicolás Echevarría, Juan Diego"
2605,tt0101531,Cadence,Martin Sheen,Cadence,1990-01-01,97,6,5848,Drama,"Ramon Estevez, Charlie Sheen"
2607,tt0101540,Cape Fear,Martin Scorsese,Cape Fear,1991-01-01,128,7,202112,Crime,"Robert De Niro, W. Paul Bodie, Christopher Swartout, Robert De Niro"
2609,tt0101545,Career Opportunities,Bryan Gordon,Career Opportunities,1991-01-01,83,5,15905,Comedy,"Betty Boo, Marc Clement, Frank Whaley"
2616,tt0101587,City Slickers,Ron Underwood,City Slickers,1991-01-01,113,6,59786,Comedy,"Martin Fuhrer, Jayne Meadows, Billy Crystal"
2617,tt0101588,City of Hope,John Sayles,City of Hope,1991-01-01,129,7,2578,Crime,"Maeve Kinkead, Jojo Smollett"
2618,tt0101590,Class Action,Michael Apted,Class Action,1991-01-01,110,6,7891,Drama,"Dan Hicks, Gene Hackman"
2619,tt0101592,Clearcut,Ryszard Bugajski,Clearcut,1991-01-01,100,6,1078,Drama,"Jari Sarkka, Michael Burgess, M.T. Kelly"
2621,tt0101595,Close My Eyes,Stephen Poliakoff,Close My Eyes,1991-01-01,108,6,3443,Drama,Alan Rickman
2622,tt0101597,Closet Land,Radha Bharadwaj,Closet Land,1991-01-01,89,7,2930,Drama,Madeleine Stowe
2624,tt0101605,The Commitments,Alan Parker,The Commitments,1991-01-01,118,7,36709,Comedy,"Pat Leavy, Jim Corr, Dick Clement"
2625,tt0101606,Company Business,Nicholas Meyer,Company Business,1991-01-01,98,5,3066,Action,"Mikhail Baryshnikov, Joachim Bliese, Christof Piesk, Gene Hackman"
2627,tt0101616,Coolie No. 1,David Dhawan,Coolie No. 1,1995-01-01,143,6,5472,Action,"Govinda, Govinda"
2628,tt0101625,Once Upon a Crime...,Eugene Levy,Once Upon a Crime...,1992-01-01,94,5,4881,Comedy,John Candy
2629,tt0101629,Crooked Hearts,Michael Bortman,Crooked Hearts,1991-01-01,113,6,1094,Drama,Peter Berg
2630,tt0101635,Curly Sue,John Hughes,Curly Sue,1991-01-01,101,5,22372,Comedy,"James W. Boinski, Lyle Browne, Alisan Porter, Jim Belushi"
2632,tt0101640,Raise the Red Lantern,Yimou Zhang,Da hong denglong gaogao gua,1991-01-01,125,8,33725,Drama,"Gong Li, Cuifen Cao, Fei Zhao, Gong Li"
2636,tt0101649,Thalapathi,Mani Ratnam,Thalapathi,1991-01-01,157,8,12635,Action,"Sonu Walia, Geetha, Rajinikanth"
2639,tt0101660,The Dark Backward,Adam Rifkin,The Dark Backward,1991-01-01,101,5,3785,Comedy,"Laurianne Jameson, Judd Nelson"
2641,tt0101669,Dead Again,Kenneth Branagh,Dead Again,1991-01-01,107,6,29199,Crime,"Derek Jacobi, Charles H. Maguire, Kenneth Branagh"
2643,tt0101692,Death in Brunswick,John Ruane,Death in Brunswick,1990-01-01,109,6,1331,Comedy,"Lachlan Jeffrey, Sam Neill"
2644,tt0101694,Deceived,Damian Harris,Deceived,1991-01-01,104,6,7703,Crime,"Philip Mayor, Laura Hawn, Goldie Hawn"
2646,tt0101698,Defending Your Life,Albert Brooks,Defending Your Life,1991-01-01,112,7,19638,Comedy,"Julie Cobb, Bob Braun, Gary Beach, Albert Brooks"
2647,tt0101701,Delirious,Tom Mankiewicz,Delirious,1991-01-01,96,5,9084,Comedy,"Mark Zuelke, John Candy"
2651,tt0101725,Diary of a Hitman,Roy London,Diary of a Hitman,1991-01-01,90,5,2058,Crime,"Roy London, Sherilyn Fenn"
2652,tt0101733,Dil Hai Ki Manta Nahin,Mahesh Bhatt,Dil Hai Ki Manta Nahin,1991-01-01,154,7,4472,Adventure,"Sharad Joshi, Aamir Khan"
2655,tt0101745,Doc Hollywood,Michael Caton-Jones,Doc Hollywood,1991-01-01,104,6,38367,Comedy,"Douglas Brush, Eyde Byrde, Raye Birk, Michael J. Fox"
2656,tt0101746,The Doctor,Randa Haines,The Doctor,1991-01-01,122,6,5746,Drama,"Stephen William Moore, William Hurt"
2657,tt0101748,Dogfight,Nancy Savoca,Dogfight,1991-01-01,94,7,9604,Comedy,"Lenny Welch, Anthony Clark, Matthew Ebert, River Phoenix"
2661,tt0101757,Don't Tell Mom the Babysitter's Dead,Stephen Herek,Don't Tell Mom the Babysitter's Dead,1991-01-01,102,6,35225,Comedy,"Timothy B. Schmit, Concetta Tomei, Christina Applegate"
2662,tt0101761,The Doors,Oliver Stone,The Doors,1991-01-01,140,7,95087,Biography,"Deborah Falconer, Val Kilmer, Kathleen Quinlan"
2663,tt0101763,God of Gamblers II,Jing Wong,Dou hap,1990-01-01,99,6,3305,Action,"Charles Heung, Andy Lau"
2664,tt0101764,Double Impact,Sheldon Lettich,Double Impact,1991-01-01,110,5,42058,Action,"Terry Carr, Jean-Claude Van Damme, Sheldon Lettich"
2665,tt0101765,The Double Life of VǸronique,Krzysztof Kieslowski,La double vie de VǸronique,1991-01-01,98,7,50357,Drama,"Irène Jacob, Aleksander Bardini, Guillaume de Tonquédec, Irène Jacob"
2666,tt0101772,The Boys from St. Petri,Søren Kragh-Jacobsen,Drengene fra Sankt Petri,1991-01-01,111,7,2155,Drama,"Xenia Lach-Nielsen, Christian Grønvall, Tomas Villum Jensen"
