,tconst,primaryTitle,Directors,originalTitle,startYear,runtimeMinutes,averageRating,numVotes,genre 1,Crew
6879,tt0122227,Treasure Island,David Cherkasskiy,Ostrov Sokrovishch,1989-01-01,107,8,3859,Adventure,"David Cherkasskiy, Radna Sakhaltuev, Viktor Andrienko, Valeriy Bessarab"
6881,tt0122234,The Meeting Point,Goran Markovic,Sabirni centar,1989-01-01,98,8,3146,Comedy,"Zoran Cosic, Aleksandra Pleskonjic, Rade Markovic"
6887,tt0122427,Chaalbaaz,Pankaj Parashar,Chaalbaaz,1989-01-01,155,6,1750,Action,"Poornachandra Rao Atluri, Sridevi"
6890,tt0122459,Return to Me,Bonnie Hunt,Return to Me,2000-01-01,115,6,21732,Comedy,"Nicholas Pike, William Bronder, Carroll O'Connor, David Duchovny"
6894,tt0122515,The Acid House,Paul McGuigan,The Acid House,1998-01-01,111,6,7866,Comedy,"Nick McCabe, Paul McGuigan, Stephen McCole"
6895,tt0122529,Henry Fool,Hal Hartley,Henry Fool,1997-01-01,137,7,7460,Comedy,"Paul Boocock, Marissa Chibas, Camille Paglia, Thomas Jay Ryan"
6896,tt0122541,An Ideal Husband,Oliver Parker,An Ideal Husband,1999-01-01,97,6,16194,Comedy,"Anna Patrick, Rupert Everett"
6897,tt0122573,The Last Contract,Kjell Sundvall,Sista kontraktet,1998-01-01,114,6,1339,Crime,"Kjell Sundvall, Mikael Persbrandt"
6901,tt0122642,One Tough Cop,Bruno Barreto,One Tough Cop,1998-01-01,90,5,1279,Action,"Deirdre Coleman Imus, Stephen Baldwin"
6902,tt0122648,Hardboiled Egg,Paolo Virzì,Ovosodo,1997-01-01,100,7,3713,Comedy,"Paolo Virzì, Daniela Morozzi, Edoardo Gabbriellini"
6905,tt0122690,Ronin,John Frankenheimer,Ronin,1998-01-01,122,7,187410,Action,"Natascha McElhone, Katarina Witt, Jean Reno, Robert De Niro"
6909,tt0122718,Small Soldiers,Joe Dante,Small Soldiers,1998-01-01,108,6,101832,Action,"Pat Benatar, Jonathan Bouck, Belinda Balaski, Kirsten Dunst"
6910,tt0122740,Sztos,Olaf Lubaszenko,Sztos,1997-01-01,86,6,1026,Action,"Janusz Józefowicz, Ewa Szawlowska, Ewa Gawryluk, Jan Nowicki"
6911,tt0122768,Twin Sitters,John Paragon,Twin Sitters,1994-01-01,93,5,3715,Comedy,"Peter Paul, Samir Bannout, Peter Paul"
6915,tt0122933,Analyze This,Harold Ramis,Analyze This,1999-01-01,103,6,157116,Comedy,"Billy Crystal, Elizabeth Bracco, Pasquale Cajano, Robert De Niro"
6919,tt0123003,Bruno,Shirley MacLaine,Bruno,2000-01-01,108,6,1566,Comedy,"Dylan Hubbard, Alex D. Linz"
6920,tt0123034,Dead Man's Curve,Dan Rosen,Dead Man's Curve,1998-01-01,91,5,6071,Drama,"Jan Berry, Sandra Martinez, Dan Rosen, Matthew Lillard"
6923,tt0123092,Fudoh: The New Generation,Takashi Miike,GokudÇï sengokushi: FudÇï,1996-01-01,98,7,3762,Action,"Shôsuke Tanihara, Marie Jinno, Shôsuke Tanihara"
6925,tt0123209,The Other Sister,Garry Marshall,The Other Sister,1999-01-01,129,6,12730,Comedy,"Gregg Goulet, Phil Redrow, Scott Egan, Juliette Lewis"
6926,tt0123215,Parting Shots,Michael Winner,Parting Shots,1998-01-01,99,5,1036,Comedy,"Crispian Belfrage, Mildred Shay, John Blezard, Chris Rea"
6927,tt0123221,Just the Ticket,Richard Wenk,Just the Ticket,1998-01-01,115,5,1984,Comedy,"Jack Cafferty, Andy Garcia"
6931,tt0123324,Why Do Fools Fall in Love,Gregory Nava,Why Do Fools Fall in Love,1998-01-01,116,6,4378,Biography,"Cerita Monet Bickelmann, Jimmy Merchant, Alexis Cruz, Halle Berry"
6932,tt0123328,Made in Hong Kong,Fruit Chan,Heung Gong jai jo,1997-01-01,109,7,2685,Comedy,"Sam Lee, Fruit Chan, Sam Lee"
6934,tt0123385,Artemisia,Agnès Merlet,Artemisia,1997-01-01,98,6,2157,Biography,"Silvia Bonucci, Agnès Merlet, Valentina Cervi"
6938,tt0123755,Cube,Vincenzo Natali,Cube,1997-01-01,90,7,236764,Drama,"Colin Brunton, Wiebke von Carolsfeld, Nicole de Boer"
6945,tt0123948,Cure,Kiyoshi Kurosawa,Cure,1997-01-01,111,7,17699,Crime,"Masato Hagiwara, Denden, Yoriko Dôguchi, Masato Hagiwara"
6948,tt0123964,Life,Ted Demme,Life,1999-01-01,108,6,52474,Comedy,"Ted Demme, Brooks Almy, R. Kelly, Eddie Murphy"
6950,tt0123987,Madeline,Daisy von Scherler Mayer,Madeline,1998-01-01,88,6,7735,Comedy,"Hatty Jones, Kristian de la Osa, Clare Thomas, Frances McDormand"
6954,tt0124102,Strangeland,John Pieplow,Strangeland,1998-01-01,85,5,7406,Horror,"Rex Brown, Krsztoff, R.H. Bear, Kevin Gage"
6959,tt0124179,Two Girls and a Guy,James Toback,Two Girls and a Guy,1997-01-01,84,5,8593,Drama,"Michael Mailer, Robert Downey Jr."
6960,tt0124185,Under the Skin,Carine Adler,Under the Skin,1997-01-01,82,6,1530,Drama,"Michelle Byatt, John Whitehall, Samantha Morton"
6962,tt0124198,Very Bad Things,Peter Berg,Very Bad Things,1998-01-01,100,6,47900,Comedy,"Tyler Cole Malinger, Christian Slater, Gus Olafsson"
6963,tt0124207,The Thief,Pavel Chukhray,Vor,1997-01-01,96,7,5416,Crime,"Viktor Bunakov, Mikhail Burlakov, Yuriy Mitrofanov, Vladimir Mashkov"
6964,tt0124272,The Flying Liftboy,Ben Sombogaart,Abeltje,1998-01-01,110,6,1681,Adventure,"Burny Bos, Kevin Sombogaart, Philip van Lidth de Jeude, Victor Löw"
6966,tt0124298,Blast from the Past,Hugh Wilson,Blast from the Past,1999-01-01,112,6,68343,Comedy,"Alicia Silverstone, Art Alexakis, B-Real, Brendan Fraser"
6967,tt0124312,Ashes of Paradise,Marcelo Piñeyro,Cenizas del paraÇðso,1997-01-01,116,7,1724,Crime,"Emilio Bardi, María Fiorentino, Federico D'Auria, Héctor Alterio"
6968,tt0124315,The Cider House Rules,Lasse Hallström,The Cider House Rules,1999-01-01,126,7,101607,Drama,"Jane Alexander, Michael Caine, Kathy Baker, Tobey Maguire"
6970,tt0124595,Return to Paradise,Joseph Ruben,Return to Paradise,1998-01-01,111,6,14965,Drama,"Alain Bernheim, Olivier Schatzky, Lashan Browning, Vince Vaughn"
6972,tt0124718,He Got Game,Spike Lee,He Got Game,1998-01-01,136,6,49359,Drama,"Michael Jordan, Hill Harper, Travis Best, Denzel Washington"
6974,tt0124770,Patlabor 2: The Movie,Mamoru Oshii,KidÇï keisatsu patorebǽ: The Movie 2,1993-01-01,113,7,4324,Action,"Michihiro Ikemizu, Edward Glen, Rod Boaz, Mîna Tominaga"
6976,tt0124819,Orgazmo,Trey Parker,Orgazmo,1997-01-01,94,6,37283,Comedy,"Ron Jeremy, Nikita, Dian Bachar"
6978,tt0124879,Simon Birch,Mark Steven Johnson,Simon Birch,1998-01-01,114,6,21692,Comedy,"Devon Cole Borisoff, Patrick McTavish, Sean Flynn, Ian Michael Smith"
6979,tt0124901,Thursday,Skip Woods,Thursday,1998-01-01,87,7,19040,Action,"Shawn Michael Howard, Paulina Porizkova, Heidi Grotsky, Thomas Jane"
6983,tt0125128,The Hanging Garden,Thom Fitzgerald,The Hanging Garden,1997-01-01,91,6,3026,Drama,"Heather Rankin, Ashley MacIsaac, Holly Cole"
6985,tt0125209,I Think I Do,Brian Sloan,I Think I Do,1997-01-01,90,6,1634,Comedy,"Marni Nixon, Marianne Hagan, Lane Janger, Alexis Arquette"
6992,tt0125439,Notting Hill,Roger Michell,Notting Hill,1999-01-01,124,7,322148,Comedy,"Michael Harm, Hugh Grant, Hugh Bonneville"
6994,tt0125454,Paulie,John Roberts,Paulie,1998-01-01,91,6,15679,Adventure,"Seth Mumy, Emily Mura-Smith, Peter Basch, Gena Rowlands"
6998,tt0125507,Sofies verden,Erik Gustavson,Sofies verden,1999-01-01,113,5,1949,Drama,"Edda Trandum Grjotheim, Bjarne Bjørndalen, Silje Storstein"
6999,tt0125522,Sue,Amos Kollek,Sue,1997-01-01,91,7,1456,Drama,"Frances Ensemplare, Joe McLaughlin, Anna Thomson"
7001,tt0125659,Open Your Eyes,Alejandro Amenábar,Abre los ojos,1997-01-01,119,7,70812,Drama,"José Ángel Egido, Alejandro Amenábar, Hans Burmann, Eduardo Noriega"
7002,tt0125664,Man on the Moon,Milos Forman,Man on the Moon,1999-01-01,118,7,133424,Biography,"Andy Kaufman, Kelly Aldrich, Courtney Love, Jim Carrey"
7003,tt0125678,Bongwater,Richard Sears,Bongwater,1998-01-01,97,5,4302,Comedy,Luke Wilson
7006,tt0125718,The Love-stricken,Ali Hatami,Del Shodegan,1992-01-01,91,7,1125,Drama,NONE
7011,tt0125879,Lulu on the Bridge,Paul Auster,Lulu on the Bridge,1998-01-01,103,6,4128,Drama,"Paul Auster, Harvey Keitel"
7012,tt0125971,Outside Providence,Michael Corrente,Outside Providence,1999-01-01,96,6,9083,Comedy,"Christopher Jewett, Michael Corrente, Shawn Hatosy"
7018,tt0126234,Chamatkar,Rajiv Mehra,Chamatkar,1992-01-01,171,6,6543,Comedy,Naseeruddin Shah
7019,tt0126240,Chutney Popcorn,Nisha Ganatra,Chutney Popcorn,1999-01-01,92,5,1132,Comedy,Saylor Creswell
7020,tt0126250,Cookie's Fortune,Robert Altman,Cookie's Fortune,1999-01-01,118,6,13505,Comedy,"Ernst Etchie Stroh, Anne Whitfield, Glenn Close"
7023,tt0126261,Desert Blue,Morgan J. Freeman,Desert Blue,1998-01-01,90,6,2424,Drama,"Morgan J. Freeman, Casey Affleck"
7026,tt0126344,I Went Down,Paddy Breathnach,I Went Down,1997-01-01,107,6,2192,Action,"Rachel Brady, Brendan Gleeson"
7028,tt0126388,Legionnaire,Peter MacDonald,Legionnaire,1998-01-01,99,5,24735,Action,"Terry Gilbert, Anders Peter Bro, Jean-Claude Van Damme"
7031,tt0126604,Pecker,John Waters,Pecker,1998-01-01,87,6,14468,Comedy,"Mark Joy, John Waters, Brigid Berlin, Edward Furlong"
7038,tt0126765,23,Hans-Christian Schmid,23,1998-01-01,99,7,7047,Drama,"Regine Zimmermann, Jan-Gregor Kampwirth, Jakob Claussen, August Diehl"
7041,tt0126810,Bedrooms and Hallways,Rose Troche,Bedrooms and Hallways,1998-01-01,92,6,3444,Comedy,"Donna Ewin, Rose Troche, Alfredo D. Troche, Kevin McKidd"
7042,tt0126838,Green Fish,Lee Chang-dong,Chorok mulkogi,1997-01-01,111,7,1861,Drama,"Dong-gon Kim, Han Suk-kyu"
7044,tt0126859,The Loss of Sexual Innocence,Mike Figgis,The Loss of Sexual Innocence,1999-01-01,106,5,3321,Drama,Julian Sands
7045,tt0126861,Denial,Adam Rifkin,Denial,1998-01-01,93,5,2740,Comedy,"Kristina Krofft, Lauren Rifkin, Lisa Brounstein, Jonathan Silverman"
7046,tt0126871,Deewana,Raj Kanwar,Deewana,1992-01-01,185,6,7041,Action,"Saleem, Rishi Kapoor"
7047,tt0126886,Election,Alexander Payne,Election,1999-01-01,103,7,99388,Comedy,"Jillian Crane, Reese Witherspoon, Chris Klein, Matthew Broderick"
7050,tt0126916,For Love of the Game,Sam Raimi,For Love of the Game,1999-01-01,137,6,36028,Drama,"Vince Gill, Garth Brooks, Kelly Preston, Kevin Costner"
7052,tt0126938,Hav Plenty,Christopher Scott Cherot,Hav Plenty,1997-01-01,92,6,1096,Comedy,"Tammi Jones Tanaka, Alaina Irizarry, Bridget D. Davis, Christopher Scott Cherot"
7056,tt0127045,Neon Maniacs,Joseph Mangine,Neon Maniacs,1986-01-01,91,5,2826,Horror,"Chuck Hemingway, Amber Denyse Austin, Joseph Mangine"
7059,tt0127288,Six Ways to Sunday,Adam Bernstein,Six Ways to Sunday,1997-01-01,97,6,1534,Comedy,Norman Reedus
7061,tt0127296,Splendor,Gregg Araki,Splendor,1999-01-01,93,5,3467,Comedy,"John K. Berry, Chicane, Kathleen Robertson"
7065,tt0127349,Waking the Dead,Keith Gordon,Waking the Dead,2000-01-01,105,6,7358,Drama,"Keith Gordon, Larry Marshall, Billy Crudup"
7070,tt0127516,Divorcing Jack,David Caffrey,Divorcing Jack,1998-01-01,110,6,2134,Comedy,"Christine Lampard, David Thewlis"
7071,tt0127536,Elizabeth,Shekhar Kapur,Elizabeth,1998-01-01,124,7,101626,Biography,"Sarah Owen, Lily Allen, Shekhar Kapur, Cate Blanchett"
7073,tt0127626,Kiler,Juliusz Machulski,Kiler,1997-01-01,104,7,7301,Action,"Malgorzata Kozuchowska, Szymon Majewski, Jan Englert, Cezary Pazura"
7078,tt0127722,Another Day in Paradise,Larry Clark,Another Day in Paradise,1998-01-01,101,6,8920,Crime,"Sam Moore, Mitchell Orr, James Woods"
7089,tt0128133,The Harmonists,Joseph Vilsmaier,Comedian Harmonists,1997-01-01,126,7,3516,Biography,"Meret Becker, Heinrich Schafmeister, Anna Kathrin Bleuler, Ben Becker"
7090,tt0128137,The Confession,David Hugh Jones,The Confession,1999-01-01,114,6,2643,Drama,"Todd Etelson, Ryan Marsini, Ben Kingsley"
7093,tt0128239,Grey Owl,Richard Attenborough,Grey Owl,1999-01-01,118,6,3883,Biography,"Craig Gauthier, Pierce Brosnan"
7095,tt0128278,Instinct,Jon Turteltaub,Instinct,1999-01-01,126,6,33675,Drama,"Ivonne Coll, Alex Kalognomos, Pat McNamara, Anthony Hopkins"
7096,tt0128292,Buttoners,Petr Zelenka,KnoflÇðkÇ­ri,1997-01-01,102,7,1766,Comedy,"Inka Brendlová, Jan Haubert, Pavel Zajicek"
7097,tt0128332,Innocence,Zeki Demirkubuz,Masumiyet,1997-01-01,110,8,18181,Drama,"Iskender Altin, Derya Alabora, Ajlan Aktug, Güven Kiraç"
7101,tt0128378,With Fire and Sword,Jerzy Hoffman,Ogniem i mieczem,1999-01-01,175,7,5114,Adventure,"Maciej Czapski, Karolina Lukaszewicz, Jerzy Hoffman, Izabella Scorupco"
7102,tt0128442,Rounders,John Dahl,Rounders,1998-01-01,121,7,154603,Crime,"Beeson Carroll, John Dahl, Allan Havey, Matt Damon"
7103,tt0128445,Rushmore,Wes Anderson,Rushmore,1998-01-01,93,7,189270,Comedy,"Eric Chase Anderson, Bob Casale, Bill Murray, Jason Schwartzman"
7107,tt0128853,You've Got Mail,Nora Ephron,You've Got Mail,1998-01-01,119,6,219316,Comedy,"Meg Ryan, Greg Kinnear, J.J. Sacha, Tom Hanks"
7109,tt0128977,The Bumblebee Flies Anyway,Martin Duffy,The Bumblebee Flies Anyway,1999-01-01,95,6,1775,Drama,NONE
7110,tt0129023,Dark Harbor,Adam Coleman Howard,Dark Harbor,1998-01-01,96,6,2698,Drama,"Jennifer Struk, Alan Rickman"
7115,tt0129167,The Iron Giant,Brad Bird,The Iron Giant,1999-01-01,86,8,206219,Action,"Jack Angel, Harry Connick Jr., Ray Aragon, Eli Marienthal"
7118,tt0129280,The Out-of-Towners,Sam Weisman,The Out-of-Towners,1999-01-01,90,5,14495,Comedy,"Rudy Giuliani, Peggy Mannix, Constance McCashin, Steve Martin"
7119,tt0129290,Patch Adams,Tom Shadyac,Patch Adams,1998-01-01,115,6,117138,Biography,"Peter Coyote, Ellen Albertini Dow, James Anthony Cotton, Robin Williams"
7120,tt0129332,Ravenous,Antonia Bird,Ravenous,1999-01-01,101,6,41282,Adventure,"Damon Albarn, Robert Carlyle, Rudolf Bok, Guy Pearce"
7125,tt0129659,Train Birds,Peter Lichtefeld,ZugvÇôgel - ... einmal nach Inari,1998-01-01,87,7,1221,Comedy,"Ciro de Chiara, Heike Hempel, Joachim Król"
7128,tt0129774,Bandyta,Maciej Dejczer,Bandyta,1997-01-01,102,6,1019,Drama,"Ida Jablonska, Cezary Harasimowicz, Krzysztof Hejke, Til Schweiger"
7130,tt0129884,Dog Park,Bruce McCulloch,Dog Park,1998-01-01,91,5,2306,Comedy,"Andy Bell, Bruce McCulloch, Natasha Henstridge"
7133,tt0129923,The Chambermaid on the Titanic,Bigas Luna,La femme de chambre du Titanic,1997-01-01,101,6,1416,Drama,"Franca Squarciapino, Bigas Luna, Olivier Martinez"
7137,tt0130192,Postmortem,Albert Pyun,Postmortem,1998-01-01,105,5,2082,Thriller,"David Walker, Gwyneth Guthrie, Charlie Sheen"
7141,tt0130350,Vishwatma,Rajiv Rai,Vishwatma,1992-01-01,174,6,1389,Action,"Manjunath Nayaker, Divya Bharti, Naseeruddin Shah"
7143,tt0130444,Aimee & Jaguar,Max Färberböck,AimǸe & Jaguar,1999-01-01,125,7,6755,Biography,"Felix Bold, Margit Bendokat, Ludwig Boettger, Maria Schrader"
7148,tt0130827,Run Lola Run,Tom Tykwer,Lola rennt,1998-01-01,81,7,201720,Action,"Stefan Arndt, Marc Bischoff, Tilman Büttner, Franka Potente"
7157,tt0131325,Bowfinger,Frank Oz,Bowfinger,1999-01-01,97,6,71918,Comedy,"Heather Graham, Paul J. Morra, Barry Newman, Steve Martin"
7159,tt0131369,Edtv,Ron Howard,Edtv,1999-01-01,122,6,44092,Comedy,"Jenna Elfman, Meredith Brooks, Arianna Huffington, Matthew McConaughey"
7161,tt0131479,Detective Conan: The Time Bombed Skyscraper,Kenji Kodama,Meitantei Conan: Tokei-jikake no matenrou,1997-01-01,94,7,3200,Adventure,"Kyoko, Wakana Yamazaki, Minami Takayama"
7163,tt0131566,Rogue Trader,James Dearden,Rogue Trader,1999-01-01,101,6,10362,Crime,"David Frost, Yves Beneyton, Ewan McGregor"
7165,tt0131857,BASEketball,David Zucker,BASEketball,1998-01-01,103,6,63696,Comedy,"Aaron Barrett, Dian Bachar, Yasmine Bleeth"
7171,tt0132347,Mystery Men,Kinka Usher,Mystery Men,1999-01-01,121,6,68495,Action,"Hank Azaria, Angelica Bridges, David Avadon, Ben Stiller"
7172,tt0132477,October Sky,Joe Johnston,October Sky,1999-01-01,108,7,93852,Biography,"Chris Owen, Joe Johnston, William Lee Scott, Jake Gyllenhaal"
7174,tt0132512,At First Sight,Irwin Winkler,At First Sight,1999-01-01,128,5,13975,Drama,"Ricky Trammell, Nina Griscom, Carl J. Matusovich, Val Kilmer"
7177,tt0132905,No One Writes to the Colonel,Arturo Ripstein,El coronel no tiene quien le escriba,1999-01-01,122,6,1182,Drama,Fernando Luján
7182,tt0133024,Ishq,Indra Kumar,Ishq,1997-01-01,161,6,11213,Action,"Sanjay Goradia, Mohan Joshi, Ghanshyam Nayak, Aamir Khan"
7184,tt0133046,Teaching Mrs. Tingle,Kevin Williamson,Teaching Mrs. Tingle,1999-01-01,96,5,21152,Comedy,"Bree Sharp, Karen Brewer, Barry Watson, Helen Mirren"
7186,tt0133059,Lawyer Lawyer,Joe Ma,Suen sei cho,1997-01-01,85,6,1653,Comedy,Stephen Chow
7189,tt0133104,Rebirth of Mothra II,Kunio Miyoshi,Mosura 2: Kaitei no daikessen,1997-01-01,100,5,1135,Fantasy,Sayaka Yamaguchi
7190,tt0133122,New Rose Hotel,Abel Ferrara,New Rose Hotel,1998-01-01,93,5,5692,Drama,"Abel Ferrara, Christian Halsey Solomon, Rachel Uchitel, Christopher Walken"
7192,tt0133162,Some Birds Can't Fly,Petar Lalovic,Ptice koje ne polete,1997-01-01,90,7,1016,Drama,"Milan Spicek, Ksenija Zecevic, Petar Lalovic, Selimir Tosic"
7193,tt0133170,"Welcome Back, Mr. McDonald",Kôki Mitani,Rajio no jikan,1997-01-01,103,7,1969,Comedy,"Masahiko Nishimura, Kôki Mitani, Toshiaki Karasawa"
7194,tt0133189,SLC Punk!,James Merendino,SLC Punk!,1998-01-01,97,7,30958,Comedy,"Prince Buster, Adam Ant, Jennifer Lien, Matthew Lillard"
7200,tt0133314,Paparazzi,Alain Berbérian,Paparazzi,1998-01-01,111,5,1033,Comedy,"Alain Berbérian, Claire Chazal, Patrick Timsit"
7205,tt0133363,Lovers of the Arctic Circle,Julio Medem,Los amantes del CÇðrculo Polar,1998-01-01,112,7,19750,Drama,"Outi Alanen, Heikki Ahonius, María Isasi, Najwa Nimri"
7206,tt0133385,Asterix and Obelix vs. Caesar,Claude Zidi,AstǸrix & ObǸlix contre CǸsar,1999-01-01,109,5,43495,Adventure,"John Baddeley, Douglas Blackwell, Laetitia Casta, Christian Clavier"
7207,tt0133412,Best Laid Plans,Mike Barker,Best Laid Plans,1999-01-01,92,6,8087,Crime,"Dirty Denny, Jeff Balis, Peter Christian White, Alessandro Nivola"
7209,tt0133751,The Faculty,Robert Rodriguez,The Faculty,1998-01-01,104,6,127567,Horror,"Summer Phoenix, Josh Hartnett, Allison Baker, Jordana Brewster"
7211,tt0133826,Guru,Rajiv Anchal,Guru,1997-01-01,136,8,3327,Drama,Mohanlal
7213,tt0133906,Kummeli Goldrush,Matti Grönberg,Kummeli Kultakuume,1997-01-01,96,7,3687,Adventure,"Janne Auvinen, Jukka Puotila, Ari Myllyselkä, Heikki Hela"
7215,tt0133952,The Siege,Edward Zwick,The Siege,1998-01-01,116,6,74929,Action,"Frank DiElsi, Sami Bouajila, Riccardo Bertoni, Denzel Washington"
7216,tt0133985,A Murder of Crows,Rowdy Herrington,A Murder of Crows,1998-01-01,102,6,8489,Action,"Erik Thompson, Cuba Gooding Jr."
7222,tt0134033,Plunkett & Macleane,Jake Scott,Plunkett & Macleane,1999-01-01,99,6,10191,Action,"Richard Gironi, Milena Sajdkova, Dean Cook, Robert Carlyle"
7223,tt0134057,The Raffle,Francesco Laudadio,La riffa,1991-01-01,93,5,1077,Comedy,"Gianluca Favilla, Roberto Della Casa, Francesco Laudadio, Monica Bellucci"
7224,tt0134084,Scream 3,Wes Craven,Scream 3,2000-01-01,116,5,151807,Horror,"Parker Posey, Scott Foley, Jenny McCarthy-Wahlberg, David Arquette"
7225,tt0134119,The Talented Mr. Ripley,Anthony Minghella,The Talented Mr. Ripley,1999-01-01,139,7,217401,Crime,"Jude Law, Matt Damon, Jack Davenport"
7227,tt0134154,Ride with the Devil,Ang Lee,Ride with the Devil,1999-01-01,138,6,14054,Drama,"Paul Meier, Buck Baker, Tobey Maguire"
7229,tt0134230,Zimmer Feri,Péter Tímár,Zimmer Feri,1998-01-01,97,6,1844,Comedy,"Vanda Kovács, Anikó Gálfi, István Csutka, Gábor Reviczky"
7230,tt0134273,8MM,Joel Schumacher,8MM,1999-01-01,123,6,136167,Crime,"Marlene Arvan, Joel Schumacher, Kiva Dawson, Nicolas Cage"
7232,tt0134618,"Mystery, Alaska",Jay Roach,"Mystery, Alaska",1999-01-01,119,6,27586,Comedy,"Beth Littleford, Randall Arney, Dale Kushner, Russell Crowe"
7233,tt0134619,Disturbing Behavior,David Nutter,Disturbing Behavior,1998-01-01,84,5,23807,Horror,"Katie Holmes, Crystal Cass, Jarred Blancard, James Marsden"
7234,tt0134630,Duets,Bruce Paltrow,Duets,2000-01-01,112,6,9785,Comedy,"John Pinette, Amanda Kravat, Joe Nanini, Huey Lewis"
7236,tt0134664,Full Alert,Ringo Lam,Go do gaai bei,1997-01-01,98,6,1228,Action,"Raymond Cho, Monica Chan, Ching Wan Lau"
7237,tt0134786,The Graduates,Nicolae Corjos,Liceenii,1986-01-01,95,8,2250,Comedy,"Stefan Banica Jr., Costin Marculescu, Stefan Banica Jr."
7240,tt0134847,Pitch Black,David Twohy,Pitch Black,2000-01-01,109,7,245175,Action,"Ken Wheat, Rhiana Griffith, Radha Mitchell"
7242,tt0134928,Spiral,Jôji Iida,Rasen,1998-01-01,97,5,3658,Drama,"Miki Nakatani, Hinako Saeki, Kôichi Satô"
7244,tt0135033,Poison for the Fairies,Carlos Enrique Taboada,Veneno para las hadas,1986-01-01,90,7,1954,Fantasy,"Araceli de León, Carlos Enrique Taboada, Ana Patricia Rojo"
7245,tt0135037,Venus Wars,Yoshikazu Yasuhiko,Venus Senki,1989-01-01,103,6,1824,Action,"Tsukasa Dokite, Bradley Cole, Michael Bakewell, Katsuhide Uekusa"
7254,tt0135641,Sapoot,Jagdish A. Sharma,Sapoot,1996-01-01,158,5,1176,Action,Akshay Kumar
7258,tt0135790,Bang Boom Bang - Ein todsicheres Ding,Peter Thorwarth,Bang Boom Bang - Ein todsicheres Ding,1999-01-01,110,7,10462,Action,"Peter Ender, Al Bano, Dieter Bohlen, Oliver Korittke"
7261,tt0136244,Hideous Kinky,Gillies MacKinnon,Hideous Kinky,1998-01-01,98,6,6792,Adventure,"Esther Freud, Bella Riza, Abderrahim Bargache, Kate Winslet"
7262,tt0136352,Koyla,Rakesh Roshan,Koyla,1997-01-01,166,6,9348,Action,"Salim Ghouse, Shah Rukh Khan"
7266,tt0136694,Snowman,Davood Mir-Bagheri,Adam barfi,1995-01-01,109,6,2304,Comedy,NONE
7269,tt0137079,Lola and Billy the Kid,Kutlug Ataman,Lola + Bilidikid,1999-01-01,93,6,1354,Drama,"Kutlug Ataman, Jan Andres"
7271,tt0137100,Maya,Ketan Mehta,Maya,1993-01-01,130,5,2273,Drama,Deepa Sahi
7274,tt0137201,Rudolph the Red-Nosed Reindeer: The Movie,William R. Kowalchuk Jr.,Rudolph the Red-Nosed Reindeer: The Movie,1998-01-01,92,5,2948,Adventure,"William R. Kowalchuk Jr., Johnny Tillotson, John Goodman"
7278,tt0137338,200 Cigarettes,Risa Bramon Garcia,200 Cigarettes,1999-01-01,101,5,15887,Comedy,"Courtney Love, Risa Bramon Garcia, Ben Affleck"
7280,tt0137363,Arlington Road,Mark Pellington,Arlington Road,1999-01-01,117,7,88697,Action,"Darryl Cox, Marc Andrus, Paul Meier, Jeff Bridges"
7281,tt0137386,Billy's Hollywood Screen Kiss,Tommy O'Haver,Billy's Hollywood Screen Kiss,1998-01-01,92,6,3917,Comedy,"Bonnie Biehl, Jackie Rae, Michelle Karen, Sean Hayes"
7282,tt0137401,Les Boys II,Louis Saia,Les Boys II,1998-01-01,120,6,1534,Comedy,"Enrico Ciccone, Paul Buisson, Gerry Boulet, Marc Messier"
7283,tt0137439,Autumn Tale,Éric Rohmer,Conte d'automne,1998-01-01,112,7,5754,Comedy,"Marie Rivière, Alexia Portal, Marie Rivière"
7284,tt0137494,Entrapment,Jon Amiel,Entrapment,1999-01-01,113,6,119300,Action,"Laura Netscher, Catherine Zeta-Jones, Jon Amiel, Sean Connery"
7285,tt0137523,Fight Club,David Fincher,Fight Club,1999-01-01,139,8,2166625,Drama,"Christina Cabot, Helena Bonham Carter, Meat Loaf, Brad Pitt"
7286,tt0137799,Ground Control,Richard Howard,Ground Control,1998-01-01,93,5,2582,Action,"Jeff Wiens, John De Troia, Kiefer Sutherland"
7291,tt0138097,Shakespeare in Love,John Madden,Shakespeare in Love,1998-01-01,123,7,228524,Comedy,"Judi Dench, Geoffrey Rush, Gwyneth Paltrow"
7296,tt0138304,The Astronaut's Wife,Rand Ravich,The Astronaut's Wife,1999-01-01,109,5,56369,Drama,"Blair Brown, Sarah Dampf, Nick Cassavetes, Charlize Theron"
7299,tt0138414,Edge of Seventeen,David Moreton,Edge of Seventeen,1998-01-01,99,6,6829,Comedy,"Alison Franck, Lea DeLaria, Michael Wolfson, Chris Stafford"
7302,tt0138467,Girl,Jonathan Kahn,Girl,1998-01-01,99,5,3013,Comedy,Dominique Swain
7303,tt0138487,Head On,Ana Kokkinos,Head On,1998-01-01,104,6,4504,Drama,"Jaems Grant, Alex Dimitriades"
7305,tt0138510,Idle Hands,Rodman Flender,Idle Hands,1999-01-01,92,6,44700,Comedy,"Steve Van Wormer, Ace Frehley, Russ Ballard, Devon Sawa"
7309,tt0138541,Judas Kiss,Sebastian Gutierrez,Judas Kiss,1998-01-01,98,6,4070,Crime,"Bobby Hosea, Jon David Casey, Susan Chesler, Alan Rickman"
7311,tt0138587,The Lucky Guy,Lik-Chi Lee,Hang wan yat tiu lung,1998-01-01,100,6,1162,Comedy,"Lik-Chi Lee, Daniel Hiu Tung Chan"
7312,tt0138590,Twice Upon a Yesterday,Maria Ripoll,The Man with Rain in His Shoes,1998-01-01,91,6,2695,Comedy,"Rafa Russo, Maria Ripoll, Lena Headey"
7316,tt0138681,The Opportunists,Myles Connell,The Opportunists,1999-01-01,90,5,1241,Comedy,"Rick Bean, Christopher Walken"
7318,tt0138703,Phantasm IV: Oblivion,Don Coscarelli,Phantasm IV: Oblivion,1998-01-01,90,5,7972,Fantasy,"Jason Jacobs, Heidi Marnhout, Reggie Bannister, A. Michael Baldwin"
7319,tt0138704,Pi,Darren Aronofsky,Pi,1998-01-01,84,7,181939,Drama,"Darren Aronofsky, Charlotte Aronofsky, Sean Gullette"
7326,tt0138874,Three Seasons,Tony Bui,Ba mÇûa,1999-01-01,113,7,3240,Drama,"Diep Bui, Tony Bui"
7328,tt0138946,The Yards,James Gray,The Yards,2000-01-01,115,6,22067,Crime,"Keith Hernandez, Chad Aaron, Mark Wahlberg"
7329,tt0138987,20 Dates,Myles Berkowitz,20 Dates,1998-01-01,87,5,1776,Biography,"Jason Villard, Michael Mirisch, Myles Berkowitz"
7332,tt0139076,Bone Daddy,Mario Azzopardi,Bone Daddy,1998-01-01,90,5,1446,Crime,Rutger Hauer
7336,tt0139134,Cruel Intentions,Roger Kumble,Cruel Intentions,1999-01-01,97,6,196247,Drama,"Swoosie Kurtz, Ryan Phillippe, Steve Hewitt, Sarah Michelle Gellar"
7337,tt0139151,Inferno,John G. Avildsen,Desert Heat,1999-01-01,95,5,10178,Action,"Jonathan Avildsen, David 'Shark' Fralick, Nikki Bokal, Jean-Claude Van Damme"
7340,tt0139239,Go,Doug Liman,Go,1999-01-01,102,7,72885,Comedy,"Natalie Imbruglia, Sarah Polley, Jay Mohr"
7342,tt0139362,High Art,Lisa Cholodenko,High Art,1998-01-01,101,6,10832,Drama,"Lisa Cholodenko, Ally Sheedy, Nan Goldin, Radha Mitchell"
7344,tt0139388,It Had to Be You,Steven Feder,It Had to Be You,2000-01-01,96,5,2306,Comedy,"Don Stephenson, Lorraine Mazzola, Barry Preston, Natasha Henstridge"
7346,tt0139414,Lake Placid,Steve Miner,Lake Placid,1999-01-01,82,5,62909,Action,"Oliver Platt, Bridget Fonda, Natassia Malthe"
7348,tt0139462,Message in a Bottle,Luis Mandoki,Message in a Bottle,1999-01-01,126,6,39299,Drama,"Steven Eckholdt, Mark Bryan, Luis Mandoki, Kevin Costner"
7349,tt0139500,In Vanda's Room,Pedro Costa,No Quarto da Vanda,2000-01-01,171,7,1613,Drama,Pedro Costa
7351,tt0139615,Slam,Marc Levin,Slam,1998-01-01,100,7,2390,Drama,"Marion Barry Jr., Taylor Mali, Saul Williams"
