,tconst,primaryTitle,Directors,originalTitle,startYear,runtimeMinutes,averageRating,numVotes,genre 1,Crew
4513,tt0110622,Naked Gun 33 1/3: The Final Insult,Peter Segal,Naked Gun 33 1/3: The Final Insult,1994-01-01,83,6,107047,Comedy,"Priscilla Presley, O.J. Simpson, Vanna White, Leslie Nielsen"
4514,tt0110623,Naked in New York,Daniel Algrant,Naked in New York,1993-01-01,95,5,1706,Comedy,"Daniel Algrant, Alexander Westerman, Eric Stoltz"
4516,tt0110631,Nightwatch,Ole Bornedal,Nattevagten,1994-01-01,107,7,16580,Thriller,"Leif Adolfsson, Jesper Hyldegaard, Mika Heilmann, Nikolaj Coster-Waldau"
4517,tt0110632,Natural Born Killers,Oliver Stone,Natural Born Killers,1994-01-01,119,7,240605,Action,"Maria Pitillo, Juliette Lewis, Oliver Stone, Woody Harrelson"
4519,tt0110638,Nell,Michael Apted,Nell,1994-01-01,112,6,29886,Drama,"Marlon Jackson, Martha L. Mericka, Jodie Foster"
4522,tt0110649,The New Age,Michael Tolkin,The New Age,1994-01-01,112,5,1216,Comedy,"Bob Flanagan, Rachel Rosenthal, Peter Weller"
4523,tt0110659,In the Middle of Nowhere,Milos 'Misa' Radivojevic,Ni na nebu ni na zemlji,1994-01-01,100,7,1130,Drama,"Slobodan Simojlovic, Sandra Rodic-Jankovic, Svetozar Cvetkovic"
4525,tt0110667,Night of the Demons 2,Brian Trenchard-Smith,Night of the Demons 2,1994-01-01,96,5,5991,Comedy,"Cristi Harris, Zoe Trilling, Amelia Kinkade, Cristi Harris"
4526,tt0110668,Night of the Running Man,Mark L. Lester,Night of the Running Man,1995-01-01,93,5,1842,Action,"Heidi Thomas, Bryce Thomason, Andrew McCarthy"
4528,tt0110678,No Escape,Martin Campbell,No Escape,1994-01-01,118,6,21241,Action,"David Argue, Don Henderson, Cameron Watt, Ray Liotta"
4529,tt0110684,Nobody's Fool,Robert Benton,Nobody's Fool,1994-01-01,110,7,21499,Comedy,"Paul Newman, Bob Heitman, Alexander Goodwin, Paul Newman"
4530,tt0110689,Nostradamus,Roger Christian,Nostradamus,1994-01-01,119,5,3014,Biography,"Roger Christian, Tchéky Karyo"
4532,tt0110712,Of Love and Shadows,Betty Kaplan,Of Love and Shadows,1994-01-01,105,5,2272,Drama,"Isabel Allende, Hugo Lescano, María Fiorentino, Antonio Banderas"
4533,tt0110722,Oleanna,David Mamet,Oleanna,1994-01-01,89,6,3449,Drama,"Frank Gero, William H. Macy"
4535,tt0110729,Once Were Warriors,Lee Tamahori,Once Were Warriors,1994-01-01,102,7,35238,Crime,"Tom Burstall, George Henare, Toby Curtis"
4536,tt0110737,Only You,Norman Jewison,Only You,1994-01-01,109,6,23832,Comedy,"Eros Ramazzotti, Harry Barandes, Bob Tracey, Marisa Tomei"
4542,tt0110770,The Paperboy,Douglas Jackson,The Paper Boy,1994-01-01,97,5,1407,Horror,"Marc Marut, Alexandra Paul"
4543,tt0110771,The Paper,Ron Howard,The Paper,1994-01-01,112,6,14555,Comedy,"Erika Johnson, Aloysius R. Burke, Brenda Blackmon, Michael Keaton"
4544,tt0110776,Yvonne's Perfume,Patrice Leconte,Le parfum d'Yvonne,1994-01-01,89,6,1113,Drama,"Patrick Modiano, Laurence Lerel, Jean-Pierre Marielle"
4547,tt0110785,La pasiÇün turca,Vicente Aranda,La pasiÇün turca,1994-01-01,112,5,1099,Drama,"Georges Corraface, Ana Belén, Ana Belén"
4548,tt0110796,The Patriots,Eric Rochant,Les patriotes,1994-01-01,138,7,1350,Thriller,"Rami Danon, Yossi Banai, Yvan Attal"
4551,tt0110808,Perdiamoci di vista,Carlo Verdone,Perdiamoci di vista,1994-01-01,115,6,1048,Comedy,Carlo Verdone
4554,tt0110823,Phantasm III: Lord of the Dead,Don Coscarelli,Phantasm III: Lord of the Dead,1994-01-01,91,6,10047,Action,"Jennifer Bross, Angus Scrimm, Reggie Bannister"
4560,tt0110852,Love on Delivery,Lik-Chi Lee,Poh wai ji wong,1994-01-01,100,6,3453,Action,"Joe Cheng, Stephen Chow"
4568,tt0110882,Before the Rain,Milcho Manchevski,Pred dozhdot,1994-01-01,113,7,15290,Drama,"Ljupco Bresliski, Renée Glynne, Vanja Aljinovic, Katrin Cartlidge"
4571,tt0110889,Priest,Antonia Bird,Priest,1994-01-01,105,7,10685,Drama,"Euan Blair, Antonia Bird, Andy Roberts, Linus Roache"
4573,tt0110891,Royal Deceit,Gabriel Axel,Prince of Jutland,1994-01-01,107,5,2343,Adventure,"Sven Wichmann, Cecilie Brask, Gabriel Byrne"
4574,tt0110892,Princess Caraboo,Michael Austin,Princess Caraboo,1994-01-01,97,6,2826,Comedy,"Nick Musker, Dave Goodey, Phoebe Cates"
4578,tt0110907,Ready to Wear,Robert Altman,PrǦt-Çÿ-Porter,1994-01-01,133,5,15477,Comedy,"Sally Kellerman, Jean-Pierre Cassel, William Abello, Sophia Loren"
4579,tt0110908,Psy 2: Ostatnia krew,Wladyslaw Pasikowski,Psy 2: Ostatnia krew,1994-01-01,100,6,2601,Action,"Tomasz Jarosz, Magdalena Dandourian, Zbigniew Szczapinski, Boguslaw Linda"
4580,tt0110912,Pulp Fiction,Quentin Tarantino,Pulp Fiction,1994-01-01,154,8,2091862,Crime,"Harvey Keitel, Quentin Tarantino, Samuel L. Jackson, John Travolta"
4581,tt0110917,A Pure Formality,Giuseppe Tornatore,Una pura formalitÇÿ,1994-01-01,108,7,12074,Crime,"Mario Cecchi Gori, Blasco Giurato, Gérard Depardieu"
4583,tt0110922,Good Old Daze,Cédric Klapisch,Le pǸril jeune,1994-01-01,101,7,3060,Comedy,"Hélène Médigue, Farid Lahouassa, Aïssa Djabri, Romain Duris"
4587,tt0110932,Quiz Show,Robert Redford,Quiz Show,1994-01-01,133,7,71148,Biography,"Paul Scofield, Christopher McDonald, Merwin Goldsmith, Ralph Fiennes"
4589,tt0110939,Radioland Murders,Mel Smith,Radioland Murders,1994-01-01,108,6,3784,Comedy,"Aloysio de Oliveira, Brian Benben, Tracy Byrd"
4590,tt0110942,Raja Babu,David Dhawan,Raja Babu,1994-01-01,161,6,3011,Action,Govinda
4591,tt0110944,Rapa Nui,Kevin Reynolds,Rapa Nui,1994-01-01,107,6,5083,Action,"Eru Potaka Dewes, Anzac Wallace, Jason Scott Lee"
4592,tt0110950,Reality Bites,Ben Stiller,Reality Bites,1994-01-01,99,6,51402,Comedy,"Igor Cavalera, Pat Crawford Brown, Bill Bolender, Winona Ryder"
4593,tt0110955,The Ref,Ted Demme,The Ref,1994-01-01,97,6,25564,Comedy,"Glynis Johns, Stephen Hunter, Victor Erdos, Denis Leary"
4594,tt0110958,See How They Fall,Jacques Audiard,Regarde les hommes tomber,1994-01-01,90,6,1254,Crime,Jean-Louis Trintignant
4596,tt0110963,Queen Margot,Patrice Chéreau,La reine Margot,1994-01-01,159,7,18162,Biography,"Cécile Caillaud, Pierre Grunstein, Jean-Hugues Anglade, Isabelle Adjani"
4599,tt0110971,Renaissance Man,Penny Marshall,Renaissance Man,1994-01-01,128,6,18401,Comedy,"Stacey Dash, Lillo Brancato, Danny DeVito"
4603,tt0110989,Richie Rich,Donald Petrie,Ri¶½hie Ri¶½h,1994-01-01,95,5,70839,Comedy,"Stephi Lineburg, Claudia Schiffer, Mariangela Pino, Macaulay Culkin"
4604,tt0110997,The River Wild,Curtis Hanson,The River Wild,1994-01-01,111,6,47825,Adventure,"Van Conner, Victor Galloway, F. Paul Benz, Meryl Streep"
4605,tt0110999,The Road Killers,Deran Sarafian,The Road Killers,1994-01-01,89,5,1729,Action,"Kay Cole, Christopher Lambert"
4607,tt0111001,The Road to Wellville,Alan Parker,The Road to Wellville,1994-01-01,118,5,12688,Comedy,"Jemila Ericson, Aleksandr Slanksnis, Anthony Hopkins"
4608,tt0111003,The Puppet Masters,Stuart Orme,The Puppet Masters,1994-01-01,109,5,9376,Horror,"Eric Thal, Marianne Curan, Donald Sutherland"
4610,tt0111019,Wild Reeds,André Téchiné,Les roseaux sauvages,1994-01-01,110,7,6250,Drama,"Michèle Moretti, Frédéric Gorny, André Téchiné, Élodie Bouchez"
4614,tt0111048,S.F.W.,Jefery Levy,S.F.W.,1994-01-01,96,5,5287,Comedy,"Jill Emery, Kat Bjelland, Lori Barbero, Stephen Dorff"
4615,tt0111054,Safe Passage,Robert Allan Ackerman,Safe Passage,1994-01-01,98,6,1317,Drama,"Steven Robert Ross, Cindy Hom, Ralph Howard, Susan Sarandon"
4616,tt0111055,The Silences of the Palace,Moufida Tlatli,Samt El Qusur,1994-01-01,127,7,1053,Drama,"Moufida Tlatli, Hind Sabri"
4619,tt0111068,Sangharsh,Tanuja Chandra,Sangharsh,1999-01-01,127,6,5634,Action,Preity G Zinta
4620,tt0111070,The Santa Clause,John Pasquin,The Santa Clause,1994-01-01,97,6,124431,Comedy,"Tim Allen, David Avalon, Ron Hartmann, Tim Allen"
4625,tt0111093,Scorned,Andrew Stevens,Scorned,1993-01-01,100,5,1877,Drama,"Daniel McVicar, Anya Longwell, Shannon Tweed"
4626,tt0111094,The Scout,Michael Ritchie,The Scout,1994-01-01,101,5,6719,Comedy,"Bret Saberhagen, Ken Brett, Keith Hernandez, Albert Brooks"
4628,tt0111102,Second Best,Chris Menges,Second Best,1994-01-01,105,6,1784,Drama,"David Cook, Doris Hare, William Hurt"
4629,tt0111112,The Secret of Roan Inish,John Sayles,The Secret of Roan Inish,1994-01-01,103,7,9467,Drama,"Eileen Colgan, Richard Sheridan"
4632,tt0111127,Serial Mom,John Waters,Serial Mom,1994-01-01,95,6,30966,Comedy,"Joan Rivers, Kathleen Turner, Sam Waterston"
4636,tt0111143,The Shadow,Russell Mulcahy,The Shadow,1994-01-01,108,6,26130,Action,"Jeff Cahill, June Samson, Nathan Jung, Alec Baldwin"
4637,tt0111149,Shallow Grave,Danny Boyle,Shallow Grave,1994-01-01,89,7,63410,Crime,"John Hodge, Danny Boyle, Christopher Eccleston, Kerry Fox"
4638,tt0111161,The Shawshank Redemption,Frank Darabont,The Shawshank Redemption,1994-01-01,142,9,2723406,Drama,"Mark Rolston, Frank Darabont, Stephen King, Tim Robbins"
4641,tt0111173,Shopping,Paul W.S. Anderson,Shopping,1994-01-01,105,5,2923,Action,"Shion Abdillah, Dominick Reyntiens, Sadie Frost"
4642,tt0111174,Showdown,Robert Radler,Showdown,1993-01-01,98,5,1179,Action,"Dwayne Murakami, Billy Blanks"
4643,tt0111175,Shrunken Heads,Richard Elfman,Shrunken Heads,1994-01-01,86,5,1484,Comedy,"Milton Elfman, Zoltan Hargitay, Julius Harris"
4648,tt0111187,Silent Fall,Bruce Beresford,Silent Fall,1994-01-01,101,5,4638,Drama,"Mary Kate Law, Richard Dreyfuss"
4649,tt0111194,A Simple Twist of Fate,Gillies MacKinnon,A Simple Twist of Fate,1994-01-01,106,6,5821,Comedy,"Ed Grady, Alana Austin, Shauna Leigh Austin, Steve Martin"
4653,tt0111201,Sirens,John Duigan,Sirens,1994-01-01,98,5,11151,Comedy,"Tara Fitzgerald, Pamela Rabe, Elle Macpherson, Hugh Grant"
4654,tt0111205,Sister My Sister,Nancy Meckler,Sister My Sister,1994-01-01,89,6,3497,Drama,"Caroline Amies, Aimee Schmidt, Jodhi May, Julie Walters"
4656,tt0111216,Slaughter of the Innocents,James Glickenhaus,Slaughter of the Innocents,1993-01-01,104,5,1089,Crime,"J. Stephen Brady, Rachel Jolley, Jan Broberg"
4657,tt0111218,Sleep with Me,Rory Kelly,Sleep with Me,1994-01-01,86,5,2741,Comedy,"Neal Jimenez, Dean Cameron, Craig Sheffer"
4665,tt0111252,Spanking the Monkey,David O. Russell,Spanking the Monkey,1994-01-01,100,6,6540,Comedy,"Judah Domke, Jeremy Davies"
4667,tt0111255,The Specialist,Luis Llosa,The Specialist,1994-01-01,110,5,67542,Action,"Gloria Estefan, Albita Rodríguez, Jerry Weintraub, Sylvester Stallone"
4668,tt0111256,Speechless,Ron Underwood,Speechless,1994-01-01,99,5,5273,Comedy,Michael Keaton
4669,tt0111257,Speed,Jan de Bont,Speed,1994-01-01,116,7,372672,Action,"Billy Idol, Alan Ruck, Keanu Reeves"
4671,tt0111271,Squanto: A Warrior's Tale,Xavier Koller,Squanto: A Warrior's Tale,1994-01-01,102,6,1335,Adventure,"Katherine Sorbey, Adam Beach"
4674,tt0111280,Star Trek: Generations,David Carson,Star Trek: Generations,1994-01-01,118,6,83878,Action,"Michael Dorn, John A. Alonzo, Jonathan Frakes, Patrick Stewart"
4675,tt0111282,Stargate,Roland Emmerich,Stargate,1994-01-01,116,7,195714,Action,"Eric Beauchamp, Alexis Cruz, Mili Avital, Kurt Russell"
4676,tt0111292,Stockholm Marathon,Peter Keglevic,Stockholm Marathon,1994-01-01,87,5,1256,Crime,"Christer Flodin, Gösta Ekman"
4677,tt0111293,The StÇôned Age,James Melkonian,The StÇôned Age,1994-01-01,90,6,5115,Comedy,"Chad Wackerman, Stacey Giugliano, Richard Chaim"
4679,tt0111308,Suhaag,Kuku Kohli,Suhaag,1994-01-01,145,5,1964,Action,Ajay Devgn
4680,tt0111323,Surviving the Game,Ernest R. Dickerson,Surviving the Game,1994-01-01,96,6,12357,Action,Rutger Hauer
4682,tt0111333,The Swan Princess,Richard Rich,The Swan Princess,1994-01-01,93,6,25796,Adventure,"Michael Dees, Liz Callaway, Paul Ainsley, Jack Palance"
4683,tt0111341,Satantango,Béla Tarr,SÇ­tÇ­ntangÇü,1994-01-01,439,8,11692,Drama,"György Fehér, György Barkó, Ágnes Kamondy, Mihály Vig"
4684,tt0111342,The Separation,Christian Vincent,La sǸparation,1994-01-01,88,6,1118,Drama,"Laurence Lerel, Nina Morato, Isabelle Huppert"
4687,tt0111359,Tall Tale,Jeremiah S. Chechik,Tall Tale,1995-01-01,96,5,3999,Adventure,Patrick Swayze
4688,tt0111361,Tammy and the T-Rex,Stewart Raffill,Tammy and the T-Rex,1994-01-01,82,5,4838,Comedy,"Gary Brockette, Denise Richards"
4693,tt0111400,Terminal Velocity,Deran Sarafian,Terminal Velocity,1994-01-01,102,5,14198,Action,"Nastassja Kinski, Rosie Flores, Dennis Donnelly, Charlie Sheen"
4694,tt0111403,The Tit and the Moon,Bigas Luna,La teta y la luna,1994-01-01,90,6,3254,Comedy,"Frédéric Lasaygues, Biel Duran"
4699,tt0111418,Threesome,Andrew Fleming,Threesome,1994-01-01,93,6,13356,Comedy,"Jillian Johns, Lynn Bopeley, Ivan Král, Lara Flynn Boyle"
4704,tt0111438,Timecop,Peter Hyams,Timecop,1994-01-01,99,5,61198,Action,"Robert Lamm, Cole Bradsen, Clint DeBoer, Jean-Claude Van Damme"
4709,tt0111454,Tom & Viv,Brian Gilbert,Tom & Viv,1994-01-01,125,6,1781,Biography,"Joanna McCallum, Brian Gilbert, Willem Dafoe"
4711,tt0111470,Trading Mom,Tia Brelis,Trading Mom,1994-01-01,85,5,2055,Comedy,"Rick Bridgforth, Sammy Ross, Sissy Spacek"
4712,tt0111477,Trapped in Paradise,George Gallo,Trapped in Paradise,1994-01-01,111,5,15727,Adventure,"Kirk Dunn, Brett Miller, Nicolas Cage"
4713,tt0111488,Trial by Jury,Heywood Gould,Trial by Jury,1994-01-01,107,5,1973,Crime,"Wray Downes, Joanne Whalley"
4714,tt0111495,Three Colors: Red,Krzysztof Kieslowski,Trois couleurs: Rouge,1994-01-01,99,8,105661,Drama,"Jean-Louis Trintignant, Irène Jacob, Krzysztof Kieslowski, Irène Jacob"
4716,tt0111503,True Lies,James Cameron,True Lies,1994-01-01,141,7,266707,Action,"Jamie Lee Curtis, Tom Arnold, Paul C. Babin, Arnold Schwarzenegger"
4717,tt0111507,Three Colors: White,Krzysztof Kieslowski,Trois couleurs: Blanc,1994-01-01,92,7,75796,Comedy,"Janusz Chlebowski, Krzysztof Kieslowski, Agnieszka Holland, Zbigniew Zamachowski"
4722,tt0111543,"Little Indian, Big City",Hervé Palud,Un indien dans la ville,1994-01-01,90,5,4486,Adventure,"Roland Baubeau, Philippe Bruneau, Sonia Vollereaux, Thierry Lhermitte"
4723,tt0111546,An Unforgettable Summer,Lucian Pintilie,Un ǸtǸ inoubliable,1994-01-01,82,7,1042,Drama,"Ioan Gyuri Pascu, Magda Catone, Robert Nagy, Kristin Scott Thomas"
4724,tt0111549,Uncovered,Jim McBride,Uncovered,1994-01-01,103,5,2591,Mystery,Kate Beckinsale
4727,tt0111573,The Voyeur,Tinto Brass,L'uomo che guarda,1994-01-01,98,5,3606,Drama,"Raffaella Offidani, Franco Branciaroli, Katarina Vasilissa"
4728,tt0111579,Burnt by the Sun,Nikita Mikhalkov,Utomlennye solntsem,1994-01-01,135,7,15799,Drama,"Oleg Menshikov, Vladimir Belousov, Alla Kazanskaya, Nikita Mikhalkov"
4731,tt0111590,Vanya on 42nd Street,Louis Malle,Vanya on 42nd Street,1994-01-01,119,7,4917,Comedy,"Joshua Redman, Phoebe Brand, Wallace Shawn"
4740,tt0111640,Voll normaaal,Ralf Huettner,Voll normaaal,1994-01-01,91,5,3483,Comedy,"Jörg Evers, Renate Dissel, Tom Gerhardt"
4743,tt0111666,War of the Buttons,John Roberts,War of the Buttons,1994-01-01,94,7,4447,Adventure,"Brendan McNamara, Barry Walsh"
4744,tt0111667,The War,Jon Avnet,The War,1994-01-01,126,6,13120,Drama,"J. Cindy Hill, Christopher Fennell, Elijah Wood"
4746,tt0111686,New Nightmare,Wes Craven,Wes Craven's New Nightmare,1994-01-01,112,6,60687,Fantasy,"Daniel K. Arredondo, Wes Craven, Beans Morocco, Heather Langenkamp"
4748,tt0111689,What Happened Was...,Tom Noonan,What Happened Was...,1994-01-01,91,7,1918,Comedy,"Karen Sillas, Eric Cahan, Tom Noonan"
4749,tt0111693,When a Man Loves a Woman,Luis Mandoki,When a Man Loves a Woman,1994-01-01,126,6,22778,Drama,"Wojciech Michniewski, Erinn Canavan, Robert Cray, Meg Ryan"
4751,tt0111701,White Fang 2: Myth of the White Wolf,Ken Olin,White Fang 2: Myth of the White Wolf,1994-01-01,106,5,2423,Adventure,"Woodrow W. Morrison, Scott Bairstow"
4752,tt0111712,Widows' Peak,John Irvin,Widows' Peak,1994-01-01,101,6,1793,Comedy,"John Irvin, Leo Austin, Joan Plowright"
4754,tt0111732,With Honors,Alek Keshishian,With Honors,1994-01-01,101,6,15122,Comedy,"Gore Vidal, David Alberico, Harve Kolzow, Joe Pesci"
4756,tt0111742,Wolf,Mike Nichols,Wolf,1994-01-01,125,6,57910,Drama,"Irene Cagen, Cynthia O'Neal, Lisa Emery, Jack Nicholson"
4760,tt0111756,Wyatt Earp,Lawrence Kasdan,Wyatt Earp,1994-01-01,191,6,52684,Action,"Joanna Going, Linden Ashby, Karen Grassle, Kevin Costner"
4770,tt0111786,In the Heat of the Sun,Wen Jiang,Yang guang can lan de ri zi,1994-01-01,134,8,5073,Drama,"Changning Gu, Yu Xia"
4771,tt0111787,Yankee Zulu,Gray Hofmeyr,Yankee Zulu,1993-01-01,100,6,1845,Comedy,"Leon Schuster, Leon Schuster"
4773,tt0111793,Yeh Dillagi,Naresh Malhotra,Yeh Dillagi,1994-01-01,155,5,4642,Comedy,Kajol
4774,tt0111797,Eat Drink Man Woman,Ang Lee,Yin shi nan nu,1994-01-01,124,7,21975,Comedy,"Jui Wang, Yu-Wen Wang, Sihung Lung"
4776,tt0111800,Wing Chun,Woo-Ping Yuen,Wing Chun,1994-01-01,96,7,3307,Action,"Wai-Lim Chu, Yi Zhao, Michelle Yeoh"
4777,tt0111807,Yrrol - En kolossalt genomtÇÏnkt film,Peter Dalle,Yrrol - En kolossalt genomtÇÏnkt film,1994-01-01,88,6,4158,Comedy,"Rolf Börjlind, Åke Lindemalm, Peter Dalle, Suzanne Reuter"
4782,tt0111835,The Defender,Corey Yuen,Zhong Nan Hai bao biao,1994-01-01,92,6,5401,Action,"Christy Chung, Jet Li"
4784,tt0111845,Through the Olive Trees,Abbas Kiarostami,Zire darakhatan zeyton,1994-01-01,103,7,9124,Drama,"Abbas Kiarostami, Mohamad Ali Keshavarz"
4787,tt0111862,Ç?nglagǾrd - Andra sommaren,Colin Nutley,Ç?nglagǾrd - Andra sommaren,1994-01-01,137,5,2244,Comedy,"Rikard Wolff, Viveka Seldahl, Tord Peterson, Helena Bergström"
4788,tt0112257,"301, 302",Cheol-su Park,"301, 302",1995-01-01,100,6,1128,Horror,"Suh-Goon Lee, Pang Eun-jin"
4789,tt0112281,Ace Ventura: When Nature Calls,Steve Oedekerk,Ace Ventura: When Nature Calls,1995-01-01,90,6,223304,Adventure,"Danny Daniels, Sophie Okonedo, Jim Carrey"
4791,tt0112288,The Addiction,Abel Ferrara,The Addiction,1995-01-01,82,6,10671,Drama,"Kevin Scullin, Lili Taylor"
4793,tt0112302,Tom and Huck,Peter Hewitt,Tom and Huck,1995-01-01,97,5,11218,Adventure,"Jonathan Taylor Thomas, Jim Aycock, Heath Lamberts, Jonathan Taylor Thomas"
4795,tt0112313,Akele Hum Akele Tum,Mansoor Khan,Akele Hum Akele Tum,1995-01-01,160,6,5275,Drama,Aamir Khan
4799,tt0112342,The Amazing Panda Adventure,Christopher Cain,The Amazing Panda Adventure,1995-01-01,84,5,4259,Adventure,"Joanne Dorian, Yu Lang, Stephen Lang"
4801,tt0112346,The American President,Rob Reiner,The American President,1995-01-01,114,6,58712,Comedy,"Tom Dahlgren, David Paymer, Rob Klein, Michael Douglas"
4805,tt0112362,Angel Baby,Michael Rymer,Angel Baby,1995-01-01,105,7,1514,Drama,"Jacqueline McKenzie, Michael Rymer, John Burgess, John Lynch"
4807,tt0112365,Angels and Insects,Philip Haas,Angels and Insects,1995-01-01,116,6,4726,Drama,"Douglas Henshall, Gareth Knapman, Mark Rylance"
4808,tt0112366,Guardian Angels,Jean-Marie Poiré,Les anges gardiens,1995-01-01,110,5,3362,Action,"Jean-Henri Compère, Antoine Baud, Eva Herzigova, Gérard Depardieu"
4809,tt0112368,Angus,Patrick Read Johnson,Angus,1995-01-01,90,6,6901,Comedy,"Michael MacLeod, Grant Hoover, Bob Pepper, Charlie Talbert"
4811,tt0112379,Antonia's Line,Marleen Gorris,Antonia,1995-01-01,102,7,9189,Comedy,"Els Dottermans, Willeke van Ammelrooy"
4814,tt0112384,Apollo 13,Ron Howard,Apollo 13,1995-01-01,140,7,301334,Adventure,"Kathleen Quinlan, Joseph Culp, Ron Howard, Tom Hanks"
4815,tt0112386,The Apprentices,Pierre Salvadori,Les apprentis,1995-01-01,95,7,1097,Comedy,"Guillaume Depardieu, Marie Trintignant"
4816,tt0112387,Fresh Bait,Bertrand Tavernier,L'appǽt,1995-01-01,115,6,2307,Crime,"Marie Gillain, Marie Gillain"
4817,tt0112389,The Thief and the Cobbler,Richard Williams,The Thief and the Cobbler,1993-01-01,99,7,4293,Action,"Eddie Carroll, Becky Bristow, Steve Lively, Vincent Price"
4818,tt0112401,Assassins,Richard Donner,Assassins,1995-01-01,133,6,85379,Action,"Tim Chitwood, David Dollase, Marta Labatut, Sylvester Stallone"
4821,tt0112427,An Awfully Big Adventure,Mike Newell,An Awfully Big Adventure,1995-01-01,112,5,2905,Comedy,"Georgina Cates, Carol Drinkwater, Agnes Bernelle, Hugh Grant"
4822,tt0112431,Babe,Chris Noonan,Babe,1995-01-01,91,6,128531,Comedy,"Chris Noonan, Gemini Barnett, Paul Goddard, James Cromwell"
4824,tt0112435,The Baby-Sitters Club,Melanie Mayron,The Baby-Sitters Club,1995-01-01,94,5,5973,Comedy,"Jeffrey Quittman, Lily Costner, Jonah Bliss, Schuyler Fisk"
4825,tt0112442,Bad Boys,Michael Bay,Bad Boys,1995-01-01,119,6,272875,Action,"Joe Pantoliano, Martin Lawrence, Douglas F. O'Neons, Will Smith"
4826,tt0112443,Bad Company,Damian Harris,Bad Company,1995-01-01,108,5,3239,Crime,"Jochen Kowalski, Noel McKoy, Ellen Barkin"
4827,tt0112444,My Teacher's Wife,Bruce Leddy,My Teacher's Wife,1999-01-01,89,5,1873,Comedy,"Ira David Wood III, Tighe Swanson, Jason London"
4828,tt0112445,The White Balloon,Jafar Panahi,Badkonake sefid,1995-01-01,85,7,7840,Drama,NONE
4830,tt0112459,Barsaat,Rajkumar Santoshi,Barsaat,1995-01-01,166,5,1323,Action,"Twinkle Khanna, Bobby Deol"
4832,tt0112461,The Basketball Diaries,Scott Kalvert,The Basketball Diaries,1995-01-01,102,7,114857,Biography,"Bruno Kirby, Alexander Chaplin, Jim Carroll, Leonardo DiCaprio"
4833,tt0112462,Batman Forever,Joel Schumacher,Batman Forever,1995-01-01,121,5,257431,Action,"Mitchell Gaylord, Michael Gough, Noby Arden, Val Kilmer"
4834,tt0112471,Before Sunrise,Richard Linklater,Before Sunrise,1995-01-01,101,8,317255,Drama,"Ethan Hawke, Julie Delpy, Christian Ankowitsch, Ethan Hawke"
4836,tt0112480,Bert: The Last Virgin,Tomas Alfredson,Bert - Den siste oskulden,1995-01-01,100,5,2050,Comedy,"Katinka Hollenberg, Ebba Beckman, Axel Heckscher, Martin Andersson"
4838,tt0112495,Beyond Rangoon,John Boorman,Beyond Rangoon,1995-01-01,100,6,5304,Action,"Jit Murad, Johnny Cheah, Sherard Jayasuriya, Patricia Arquette"
4839,tt0112499,The Big Green,Holly Goldberg Sloan,The Big Green,1995-01-01,100,5,10499,Comedy,"Haley Miller, Anthony Esquivel, John Bourg, Steve Guttenberg"
4840,tt0112508,Billy Madison,Tamra Davis,Billy Madison,1995-01-01,89,6,148840,Comedy,"Tamra Davis, Norm MacDonald, Matthew Ferguson, Adam Sandler"
4843,tt0112527,Blood & Donuts,Holly Dale,Blood & Donuts,1995-01-01,89,5,1337,Comedy,Gordon Currie
4844,tt0112537,Blue Juice,Carl Prechezer,Blue Juice,1995-01-01,90,5,2825,Comedy,"Andy Bell, Sean Pertwee"
4845,tt0112546,Mouth to Mouth,Manuel Gómez Pereira,Boca a boca,1995-01-01,106,6,1724,Comedy,"Aitana Sánchez-Gijón, Jaime Bores, Javier Bardem"
4846,tt0112553,Bombay,Mani Ratnam,Bombay,1995-01-01,141,8,13090,Drama,"Manisha Koirala, Arvind Swami"
4847,tt0112556,Happiness Is in the Field,Étienne Chatiliez,Le bonheur est dans le prǸ,1995-01-01,106,7,2907,Comedy,"Eddy Mitchell, Étienne Chatiliez, Joël Cantona, Michel Serrault"
4849,tt0112562,The Scent of Joseph's Shirt,Ebrahim Hatamikia,Booy-E Pirahan-E Yusef,1995-01-01,100,6,1689,Drama,NONE
4852,tt0112571,Boys on the Side,Herbert Ross,Boys on the Side,1995-01-01,115,6,13501,Comedy,"Toni Childs, Whoopi Goldberg"
4853,tt0112572,The Brady Bunch Movie,Betty Thomas,The Brady Bunch Movie,1995-01-01,90,6,23272,Comedy,"Henriette Mantel, Florence Henderson, Eric Nies, Shelley Long"
4854,tt0112573,Braveheart,Mel Gibson,Braveheart,1995-01-01,178,8,1050177,Biography,"Mel Gibson, Angus Macfadyen, Catherine McCormack, Mel Gibson"
4857,tt0112579,The Bridges of Madison County,Clint Eastwood,The Bridges of Madison County,1995-01-01,135,7,84273,Drama,"Clint Eastwood, Richard Lage, Phyllis Lyons, Clint Eastwood"
4858,tt0112585,The Brothers McMullen,Edward Burns,The Brothers McMullen,1995-01-01,98,6,8023,Comedy,"Edward Burns, Maxine Bahns"
4864,tt0112602,Bushwhacked,Greg Beeman,Bushwhacked,1995-01-01,90,5,6577,Adventure,"Blake Bashoff, Michael Galeota, Ari Greenberg, Daniel Stern"
4865,tt0112604,Butterfly Kiss,Michael Winterbottom,Butterfly Kiss,1995-01-01,88,6,2029,Comedy,"Lisa Riley, Joanne Cook, Alistair Donald, Amanda Plummer"
4866,tt0112606,Bye Bye Love,Sam Weisman,Bye Bye Love,1995-01-01,106,6,6415,Comedy,"Mary Chapin Carpenter, Cameron Boyd, Marguerite Weisman, Matthew Modine"
4868,tt0112609,Wild Horses,Marcelo Piñeyro,Caballos salvajes,1995-01-01,122,7,1584,Comedy,"Jorge Petraglia, Álex Benn, Héctor Alterio"
4871,tt0112619,Midaq Alley,Jorge Fons,El CallejÇün de los Milagros,1995-01-01,140,7,3209,Drama,"Anna Ciocchetti, Juan Manuel Bernal, Bruno Bichir, Ernesto Gómez Cruz"
4873,tt0112625,Candyman: Farewell to the Flesh,Bill Condon,Candyman: Farewell to the Flesh,1995-01-01,95,5,13642,Horror,"Kelly Rowan, Glen Gomez, Steven Hartman, Tony Todd"
4874,tt0112637,Carrington,Christopher Hampton,Carrington,1995-01-01,121,6,5604,Biography,"Michael Holroyd, Gary Turner, Emma Thompson"
4876,tt0112641,Casino,Martin Scorsese,Casino,1995-01-01,178,8,530338,Crime,"Bill Allison, Steve Allen, Sharon Stone, Robert De Niro"
4877,tt0112642,Casper,Brad Silberling,Casper,1995-01-01,100,6,138403,Comedy,"Devon Sawa, Joe Alaskey, Christina Ricci, Bill Pullman"
4879,tt0112654,One Hundred and One Nights,Agnès Varda,Les cent et une nuits de Simon CinǸma,1995-01-01,104,6,1673,Comedy,"Romain Chaveton, Alexia Stresi, Anouk Aimée"
4886,tt0112679,Circle of Friends,Pat O'Connor,Circle of Friends,1995-01-01,103,6,8893,Drama,"Pamela Cardillo, Minnie Driver, Chris O'Donnell"
4887,tt0112688,Clockers,Spike Lee,Clockers,1995-01-01,128,6,22794,Crime,"Kewanna Bonaparte, Chantal Bushelle, Thomas Jefferson Byrd, Harvey Keitel"
4889,tt0112697,Clueless,Amy Heckerling,Clueless,1995-01-01,97,6,226992,Comedy,"Dan Hedaya, Stacey Dash, Brittany Murphy, Alicia Silverstone"
4891,tt0112702,Coldblooded,Wallace Wolodarsky,Coldblooded,1995-01-01,92,6,3920,Action,"Jack S. Krevoy, Jason Priestley"
4893,tt0112710,God's Comedy,João César Monteiro,A ComǸdia de Deus,1995-01-01,170,7,1342,Comedy,"João César Monteiro, Margaret Price"
4894,tt0112714,The Confessional,Robert Lepage,Le confessionnal,1995-01-01,100,7,1615,Drama,"Denise Robert, Alain Dostie, Paul Hébert, Lothaire Bluteau"
